Bus Hound 6.01 capture on Windows Vista (x64). Complements of www.perisoft.net

c1

  Device - Device ID (followed by the endpoint for USB devices)
            (50) USB Camera
            (51) USB Camera
            (53) USB Camera
            (55) 3D Webcam
            (57) USB2.0 PC CAMERA
            (60) USB2.0_Camera
  Phase  - Phase Type
            CTL   USB control transfer       
            IN    Data in transfer           
            ISOC  Isochronous transfer       
            OUT   Data out transfer          
            USTS  USB status                 
  Data   - Hex dump of the data transferred
  Descr  - Description of the phase
  Cmd... - Position in the captured data


Device  Phase  Data                      Description       Cmd.Phase.Ofs(rep)
------  -----  ------------------------  ----------------  ------------------
  60.0  CTL    80 06 00 01  00 00 12 00  GET DESCRIPTOR           1.1.0        
  60.0  IN     12 01 00 02  ef 02 01 40  .......@                 1.2.0        
               0f 1d 01 18  00 01 10 60  .......`                 1.2.8        
               00 01                     ..                       1.2.16       
  60.0  CTL    80 06 00 02  00 00 09 00  GET DESCRIPTOR           2.1.0        
  60.0  IN     09 02 17 02  02 01 30 80  ......0.                 2.2.0        
               fa                        .                        2.2.8        
  60.0  CTL    80 06 00 02  00 00 17 02  GET DESCRIPTOR           3.1.0        
  60.0  IN     09 02 17 02  02 01 30 80  ......0.                 3.2.0        
               fa 09 04 00  00 01 0e 01  ........                 3.2.8        
               00 60 0d 24  01 00 01 4d  .`.$...M                 3.2.16       
               00 c0 e1 e4  00 01 01 09  ........                 3.2.24       
  60.0  CTL    00 09 01 00  00 00 00 00  SET CONFIG               4.1.0        
  60.0  CTL    01 0b 00 00  01 00 00 00  SET INTERFACE            5.1.0        
  60.0  CTL    a1 85 00 01  00 04 02 00  GET LEN                  6.1.0        
  60.0  IN     04 00                     ..                       6.2.0        
  60.0  CTL    a1 86 00 01  00 04 01 00  GET INFO                 7.1.0        
  60.0  IN     03                        .                        7.2.0        
  60.0  CTL    a1 82 00 01  00 04 04 00  GET MIN                  8.1.0        
  60.0  IN     00 00 00 00               ....                     8.2.0        
  60.0  CTL    a1 83 00 01  00 04 04 00  GET MAX                  9.1.0        
  60.0  IN     ff ff ff ff               ....                     9.2.0        
  60.0  CTL    a1 84 00 01  00 04 04 00  GET RES                 10.1.0        
  60.0  IN     01 00 00 00               ....                    10.2.0        
  60.0  CTL    a1 87 00 01  00 04 04 00  GET DEF                 11.1.0        
  60.0  IN     00 00 00 00               ....                    11.2.0        
  60.0  CTL    a1 85 00 02  00 04 02 00  GET LEN                 12.1.0        
  60.0  IN     04 00                     ..                      12.2.0        
  60.0  CTL    a1 86 00 02  00 04 01 00  GET INFO                13.1.0        
  60.0  IN     03                        .                       13.2.0        
  60.0  CTL    a1 82 00 02  00 04 04 00  GET MIN                 14.1.0        
  60.0  IN     00 00 00 00               ....                    14.2.0        
  60.0  CTL    a1 83 00 02  00 04 04 00  GET MAX                 15.1.0        
  60.0  IN     ff ff ff ff               ....                    15.2.0        
  60.0  CTL    a1 84 00 02  00 04 04 00  GET RES                 16.1.0        
  60.0  IN     01 00 00 00               ....                    16.2.0        
  60.0  CTL    a1 87 00 02  00 04 04 00  GET DEF                 17.1.0        
  60.0  IN     00 00 00 00               ....                    17.2.0        
  60.0  CTL    a1 85 00 03  00 04 02 00  GET LEN                 18.1.0        
  60.0  IN     04 00                     ..                      18.2.0        
  60.0  CTL    a1 86 00 03  00 04 01 00  GET INFO                19.1.0        
  60.0  IN     03                        .                       19.2.0        
  60.0  CTL    a1 82 00 03  00 04 04 00  GET MIN                 20.1.0        
  60.0  IN     00 00 00 00               ....                    20.2.0        
  60.0  CTL    a1 83 00 03  00 04 04 00  GET MAX                 21.1.0        
  60.0  IN     ff ff ff ff               ....                    21.2.0        
  60.0  CTL    a1 84 00 03  00 04 04 00  GET RES                 22.1.0        
  60.0  IN     01 00 00 00               ....                    22.2.0        
  60.0  CTL    a1 87 00 03  00 04 04 00  GET DEF                 23.1.0        
  60.0  IN     00 00 00 00               ....                    23.2.0        
  60.0  CTL    a1 85 00 04  00 04 02 00  GET LEN                 24.1.0        
  60.0  IN     04 00                     ..                      24.2.0        
  60.0  CTL    a1 86 00 04  00 04 01 00  GET INFO                25.1.0        
  60.0  IN     03                        .                       25.2.0        
  60.0  CTL    a1 82 00 04  00 04 04 00  GET MIN                 26.1.0        
  60.0  IN     00 00 00 00               ....                    26.2.0        
  60.0  CTL    a1 83 00 04  00 04 04 00  GET MAX                 27.1.0        
  60.0  IN     ff ff ff ff               ....                    27.2.0        
  60.0  CTL    a1 84 00 04  00 04 04 00  GET RES                 28.1.0        
  60.0  IN     01 00 00 00               ....                    28.2.0        
  60.0  CTL    a1 87 00 04  00 04 04 00  GET DEF                 29.1.0        
  60.0  IN     00 00 00 00               ....                    29.2.0        
  60.0  CTL    a1 85 00 05  00 04 02 00  GET LEN                 30.1.0        
  60.0  IN     04 00                     ..                      30.2.0        
  60.0  CTL    a1 86 00 05  00 04 01 00  GET INFO                31.1.0        
  60.0  IN     03                        .                       31.2.0        
  60.0  CTL    a1 82 00 05  00 04 04 00  GET MIN                 32.1.0        
  60.0  IN     00 00 00 00               ....                    32.2.0        
  60.0  CTL    a1 83 00 05  00 04 04 00  GET MAX                 33.1.0        
  60.0  IN     ff ff ff ff               ....                    33.2.0        
  60.0  CTL    a1 84 00 05  00 04 04 00  GET RES                 34.1.0        
  60.0  IN     01 00 00 00               ....                    34.2.0        
  60.0  CTL    a1 87 00 05  00 04 04 00  GET DEF                 35.1.0        
  60.0  IN     00 00 00 00               ....                    35.2.0        
  60.0  CTL    a1 85 00 06  00 04 02 00  GET LEN                 36.1.0        
  60.0  IN     04 00                     ..                      36.2.0        
  60.0  CTL    a1 86 00 06  00 04 01 00  GET INFO                37.1.0        
  60.0  IN     03                        .                       37.2.0        
  60.0  CTL    a1 82 00 06  00 04 04 00  GET MIN                 38.1.0        
  60.0  IN     00 00 00 00               ....                    38.2.0        
  60.0  CTL    a1 83 00 06  00 04 04 00  GET MAX                 39.1.0        
  60.0  IN     ff ff ff ff               ....                    39.2.0        
  60.0  CTL    a1 84 00 06  00 04 04 00  GET RES                 40.1.0        
  60.0  IN     01 00 00 00               ....                    40.2.0        
  60.0  CTL    a1 87 00 06  00 04 04 00  GET DEF                 41.1.0        
  60.0  IN     00 00 00 00               ....                    41.2.0        
  60.0  CTL    a1 85 00 07  00 04 02 00  GET LEN                 42.1.0        
  60.0  IN     0a 00                     ..                      42.2.0        
  60.0  CTL    a1 86 00 07  00 04 01 00  GET INFO                43.1.0        
  60.0  IN     03                        .                       43.2.0        
  60.0  CTL    a1 82 00 07  00 04 0a 00  GET MIN                 44.1.0        
  60.0  IN     00 00 00 00  00 00 00 00  ........                44.2.0        
               00 00                     ..                      44.2.8        
  60.0  CTL    a1 83 00 07  00 04 0a 00  GET MAX                 45.1.0        
  60.0  IN     ff ff ff ff  ff ff ff ff  ........                45.2.0        
               ff ff                     ..                      45.2.8        
  60.0  CTL    a1 84 00 07  00 04 0a 00  GET RES                 46.1.0        
  60.0  IN     01 00 00 00               ....                    46.2.0        
  60.0  CTL    a1 87 00 07  00 04 0a 00  GET DEF                 47.1.0        
  60.0  IN     00 00 00 00  00 00 00 00  ........                47.2.0        
               00 00                     ..                      47.2.8        
  60.0  CTL    a1 85 00 08  00 04 02 00  GET LEN                 48.1.0        
  60.0  IN     0a 00                     ..                      48.2.0        
  60.0  CTL    a1 86 00 08  00 04 01 00  GET INFO                49.1.0        
  60.0  IN     03                        .                       49.2.0        
  60.0  CTL    a1 82 00 08  00 04 0a 00  GET MIN                 50.1.0        
  60.0  IN     00 00 00 00  00 00 00 00  ........                50.2.0        
               00 00                     ..                      50.2.8        
  60.0  CTL    a1 83 00 08  00 04 0a 00  GET MAX                 51.1.0        
  60.0  IN     ff ff ff ff  ff ff ff ff  ........                51.2.0        
               ff ff                     ..                      51.2.8        
  60.0  CTL    a1 84 00 08  00 04 0a 00  GET RES                 52.1.0        
  60.0  IN     01 00 00 00               ....                    52.2.0        
  60.0  CTL    a1 87 00 08  00 04 0a 00  GET DEF                 53.1.0        
  60.0  IN     00 00 00 00  00 00 00 00  ........                53.2.0        
               00 00                     ..                      53.2.8        
  60.0  CTL    a1 86 00 0b  00 01 01 00  GET INFO                54.1.0        
  60.0  IN     03                        .                       54.2.0        
  60.0  CTL    a1 82 00 0b  00 01 02 00  GET MIN                 55.1.0        
  60.0  IN     00 00                     ..                      55.2.0        
  60.0  CTL    a1 83 00 0b  00 01 02 00  GET MAX                 56.1.0        
  60.0  IN     32 00                     2.                      56.2.0        
  60.0  CTL    a1 84 00 0b  00 01 02 00  GET RES                 57.1.0        
  60.0  IN     01 00                     ..                      57.2.0        
  60.0  CTL    a1 87 00 0b  00 01 02 00  GET DEF                 58.1.0        
  60.0  IN     00 00                     ..                      58.2.0        
  60.0  CTL    a1 86 00 02  00 03 01 00  GET INFO                59.1.0        
  60.0  IN     03                        .                       59.2.0        
  60.0  CTL    a1 82 00 02  00 03 02 00  GET MIN                 60.1.0        
  60.0  IN     00 00                     ..                      60.2.0        
  60.0  CTL    a1 83 00 02  00 03 02 00  GET MAX                 61.1.0        
  60.0  IN     ff 00                     ..                      61.2.0        
  60.0  CTL    a1 84 00 02  00 03 02 00  GET RES                 62.1.0        
  60.0  IN     01 00                     ..                      62.2.0        
  60.0  CTL    a1 87 00 02  00 03 02 00  GET DEF                 63.1.0        
  60.0  IN     78 00                     x.                      63.2.0        
  60.0  CTL    a1 86 00 03  00 03 01 00  GET INFO                64.1.0        
  60.0  IN     03                        .                       64.2.0        
  60.0  CTL    a1 82 00 03  00 03 02 00  GET MIN                 65.1.0        
  60.0  IN     00 00                     ..                      65.2.0        
  60.0  CTL    a1 83 00 03  00 03 02 00  GET MAX                 66.1.0        
  60.0  IN     64 00                     d.                      66.2.0        
  60.0  CTL    a1 84 00 03  00 03 02 00  GET RES                 67.1.0        
  60.0  IN     01 00                     ..                      67.2.0        
  60.0  CTL    a1 87 00 03  00 03 02 00  GET DEF                 68.1.0        
  60.0  IN     23 00                     #.                      68.2.0        
  60.0  CTL    a1 86 00 06  00 03 01 00  GET INFO                69.1.0        
  60.0  IN     03                        .                       69.2.0        
  60.0  CTL    a1 82 00 06  00 03 02 00  GET MIN                 70.1.0        
  60.0  IN     4c ff                     L.                      70.2.0        
  60.0  CTL    a1 83 00 06  00 03 02 00  GET MAX                 71.1.0        
  60.0  IN     b4 00                     ..                      71.2.0        
  60.0  CTL    a1 84 00 06  00 03 02 00  GET RES                 72.1.0        
  60.0  IN     01 00                     ..                      72.2.0        
  60.0  CTL    a1 87 00 06  00 03 02 00  GET DEF                 73.1.0        
  60.0  IN     00 00                     ..                      73.2.0        
  60.0  CTL    a1 86 00 07  00 03 01 00  GET INFO                74.1.0        
  60.0  IN     03                        .                       74.2.0        
  60.0  CTL    a1 82 00 07  00 03 02 00  GET MIN                 75.1.0        
  60.0  IN     00 00                     ..                      75.2.0        
  60.0  CTL    a1 83 00 07  00 03 02 00  GET MAX                 76.1.0        
  60.0  IN     c8 00                     ..                      76.2.0        
  60.0  CTL    a1 84 00 07  00 03 02 00  GET RES                 77.1.0        
  60.0  IN     01 00                     ..                      77.2.0        
  60.0  CTL    a1 87 00 07  00 03 02 00  GET DEF                 78.1.0        
  60.0  IN     8f 00                     ..                      78.2.0        
  60.0  CTL    a1 86 00 08  00 03 01 00  GET INFO                79.1.0        
  60.0  IN     03                        .                       79.2.0        
  60.0  CTL    a1 82 00 08  00 03 02 00  GET MIN                 80.1.0        
  60.0  IN     00 00                     ..                      80.2.0        
  60.0  CTL    a1 83 00 08  00 03 02 00  GET MAX                 81.1.0        
  60.0  IN     0a 00                     ..                      81.2.0        
  60.0  CTL    a1 84 00 08  00 03 02 00  GET RES                 82.1.0        
  60.0  IN     01 00                     ..                      82.2.0        
  60.0  CTL    a1 87 00 08  00 03 02 00  GET DEF                 83.1.0        
  60.0  IN     07 00                     ..                      83.2.0        
  60.0  CTL    a1 86 00 09  00 03 01 00  GET INFO                84.1.0        
  60.0  IN     03                        .                       84.2.0        
  60.0  CTL    a1 82 00 09  00 03 02 00  GET MIN                 85.1.0        
  60.0  IN     28 00                     (.                      85.2.0        
  60.0  CTL    a1 83 00 09  00 03 02 00  GET MAX                 86.1.0        
  60.0  IN     64 00                     d.                      86.2.0        
  60.0  CTL    a1 84 00 09  00 03 02 00  GET RES                 87.1.0        
  60.0  IN     01 00                     ..                      87.2.0        
  60.0  CTL    a1 87 00 09  00 03 02 00  GET DEF                 88.1.0        
  60.0  IN     3c 00                     <.                      88.2.0        
  60.0  CTL    a1 86 00 0a  00 03 01 00  GET INFO                89.1.0        
  60.0  IN     03                        .                       89.2.0        
  60.0  CTL    a1 82 00 0a  00 03 02 00  GET MIN                 90.1.0        
  60.0  IN     f0 0a                     ..                      90.2.0        
  60.0  CTL    a1 83 00 0a  00 03 02 00  GET MAX                 91.1.0        
  60.0  IN     64 19                     d.                      91.2.0        
  60.0  CTL    a1 84 00 0a  00 03 02 00  GET RES                 92.1.0        
  60.0  IN     01 00                     ..                      92.2.0        
  60.0  CTL    a1 87 00 0a  00 03 02 00  GET DEF                 93.1.0        
  60.0  IN     e6 13                     ..                      93.2.0        
  60.0  CTL    a1 86 00 01  00 03 01 00  GET INFO                94.1.0        
  60.0  IN     03                        .                       94.2.0        
  60.0  CTL    a1 82 00 01  00 03 02 00  GET MIN                 95.1.0        
  60.0  IN     00 00                     ..                      95.2.0        
  60.0  CTL    a1 83 00 01  00 03 02 00  GET MAX                 96.1.0        
  60.0  IN     05 00                     ..                      96.2.0        
  60.0  CTL    a1 84 00 01  00 03 02 00  GET RES                 97.1.0        
  60.0  IN     01 00                     ..                      97.2.0        
  60.0  CTL    a1 87 00 01  00 03 02 00  GET DEF                 98.1.0        
  60.0  IN     04 00                     ..                      98.2.0        
  60.0  CTL    a1 86 00 05  00 03 01 00  GET INFO                99.1.0        
  60.0  IN     03                        .                       99.2.0        
  60.0  CTL    a1 82 00 05  00 03 01 00  GET MIN                100.1.0        
  60.0  IN     00                        .                      100.2.0        
  60.0  CTL    a1 83 00 05  00 03 01 00  GET MAX                101.1.0        
  60.0  IN     02                        .                      101.2.0        
  60.0  CTL    a1 84 00 05  00 03 01 00  GET RES                102.1.0        
  60.0  IN     01                        .                      102.2.0        
  60.0  CTL    a1 87 00 05  00 03 01 00  GET DEF                103.1.0        
  60.0  IN     01                        .                      103.2.0
  60.0  CTL    a1 87 00 14  00 01 0a 00  GET DEF                104.1.0
  60.0  USTS   c0010000                  canceled               104.2.0        
  60.0  CTL    a1 81 00 0b  00 01 02 00  GET CUR                105.1.0        
  60.0  IN     00 00                     ..                     105.2.0        
  60.0  CTL    a1 81 00 02  00 03 02 00  GET CUR                106.1.0        
  60.0  IN     78 00                     x.                     106.2.0        
  60.0  CTL    a1 81 00 05  00 03 01 00  GET CUR                107.1.0(5)     
  60.0  IN     01                        .                      107.2.0        
  60.0  CTL    21 01 00 05  00 03 01 00  SET CUR                112.1.0        
  60.0  OUT    02                        .                      112.2.0        
  60.0  CTL    a1 81 00 05  00 03 01 00  GET CUR                113.1.0        
  60.0  IN     02                        .                      113.2.0        
  60.0  CTL    a1 81 00 01  00 03 02 00  GET CUR                114.1.0(2)     
  60.0  IN     04 00                     ..                     114.2.0        
  60.0  CTL    a1 81 00 02  00 03 02 00  GET CUR                116.1.0(2)     
  60.0  IN     78 00                     x.                     116.2.0        
  60.0  CTL    a1 81 00 03  00 03 02 00  GET CUR                118.1.0(2)     
  60.0  IN     23 00                     #.                     118.2.0        
  60.0  CTL    a1 81 00 06  00 03 02 00  GET CUR                120.1.0(2)     
  60.0  IN     00 00                     ..                     120.2.0        
  60.0  CTL    a1 81 00 0a  00 03 02 00  GET CUR                122.1.0        
  60.0  IN     e6 13                     ..                     122.2.0        
  60.0  CTL    a1 81 00 01  01 00 1a 00  GET CUR                123.1.0        
  60.0  IN     00 00 01 01  40 42 0f 00  ....@B..               123.2.0        
               00 00 00 00  00 00 00 00  ........               123.2.8        
               00 00 00 60  09 00 f4 0b  ...`....               123.2.16       
               00 00                     ..                     123.2.24       
  60.0  CTL    21 01 00 01  01 00 1a 00  SET CUR                124.1.0        
  60.0  OUT    00 00 01 01  15 16 05 00  ........               124.2.0        
               00 00 00 00  00 00 00 00  ........               124.2.8        
               00 00 00 60  09 00 00 00  ...`....               124.2.16       
               00 00                     ..                     124.2.24       
  60.0  CTL    a1 81 00 01  01 00 1a 00  GET CUR                125.1.0        
  60.0  IN     00 00 01 01  15 16 05 00  ........               125.2.0        
               00 00 00 00  00 00 00 00  ........               125.2.8        
               00 00 00 60  09 00 f4 0b  ...`....               125.2.16       
               00 00                     ..                     125.2.24       
  60.0  CTL    a1 83 00 01  01 00 1a 00  GET MAX                126.1.0        
  60.0  IN     00 00 01 01  15 16 05 00  ........               126.2.0        
               00 00 00 00  00 00 00 00  ........               126.2.8        
               00 00 00 60  09 00 f4 0b  ...`....               126.2.16       
               00 00                     ..                     126.2.24       
  60.0  CTL    a1 82 00 01  01 00 1a 00  GET MIN                127.1.0        
  60.0  IN     00 00 01 01  15 16 05 00  ........               127.2.0        
               00 00 00 00  00 00 00 00  ........               127.2.8        
               00 00 00 60  09 00 f4 0b  ...`....               127.2.16       
               00 00                     ..                     127.2.24       
  60.0  CTL    21 01 00 01  01 00 1a 00  SET CUR                128.1.0        
  60.0  OUT    00 00 01 01  15 16 05 00  ........               128.2.0        
               00 00 00 00  00 00 00 00  ........               128.2.8        
               00 00 00 60  09 00 00 00  ...`....               128.2.16       
               00 00                     ..                     128.2.24       
  60.0  CTL    a1 81 00 01  01 00 1a 00  GET CUR                129.1.0        
  60.0  IN     00 00 01 01  15 16 05 00  ........               129.2.0        
               00 00 00 00  00 00 00 00  ........               129.2.8        
               00 00 00 60  09 00 f4 0b  ...`....               129.2.16       
               00 00                     ..                     129.2.24       
  60.0  CTL    21 01 00 02  01 00 1a 00  SET CUR                130.1.0        
  60.0  OUT    00 00 01 01  15 16 05 00  ........               130.2.0        
               00 00 00 00  00 00 00 00  ........               130.2.8        
               00 00 00 60  09 00 f4 0b  ...`....               130.2.16       
               00 00                     ..                     130.2.24       
  60.0  CTL    01 0b 06 00  01 00 00 00  SET INTERFACE          131.1.0
  60.0  CTL    a1 81 00 0a  00 03 02 00  GET CUR                132.1.0
  60.0  IN     e6 13                     ..                     132.2.0
  60.0  CTL    a1 81 00 0b  00 01 02 00  GET CUR                133.1.0(2)
  60.0  IN     00 00                     ..                     133.2.0
  60    ISOC                                                    135.1.0
  60.1  ISOC   00 00 00 00  00 00 00 00  ........               136.1.0
               00 00 00 00               ....                   136.1.8
  60.0  CTL    a1 81 00 02  00 03 02 00  GET CUR                137.1.0(4)
  60.0  IN     78 00                     x.                     137.2.0
  60.1  ISOC   0c 8e 60 d1  a5 05 65 d1  ..`...e.               141.1.0
               a5 05 c5 00  00 00 00 00  ........               141.1.8
               00 00 00 00  00 00 00 00  ........               141.1.16
               00 00 00 00  00 00 00 00  ........               141.1.24
  60.0  CTL    a1 81 00 0b  00 01 02 00  GET CUR                142.1.0
  60.0  IN     00 00                     ..                     142.2.0
  60.1  ISOC   0c 8d 60 d1  a5 05 e5 7a  ..`....z               143.1.0
               a9 05 d5 00  00 80 00 80  ........               143.1.8
               00 80 00 80  00 80 00 80  ........               143.1.16
               00 80 00 80  00 80 00 80  ........               143.1.24
  60.1  ISOC   0c 8d 60 d1  a5 05 65 24  ..`...e$               144.1.0
               ad 05 e5 00  00 80 00 80  ........               144.1.8
               00 80 00 80  00 80 00 80  ........               144.1.16
               00 80 00 80  00 80 00 80  ........               144.1.24
  60.1  ISOC   0c 8c 40 66  ad 05 e5 cd  ..@f....               145.1.0
               b0 05 f5 00  00 80 00 80  ........               145.1.8
               00 80 00 80  00 80 00 80  ........               145.1.16
               00 80 00 80  00 80 00 80  ........               145.1.24
  60.1  ISOC   0c 8c 40 66  ad 05 65 77  ..@f..ew               146.1.0
               b4 05 05 01  00 80 00 80  ........               146.1.8
               00 80 00 80  00 80 00 80  ........               146.1.16
               00 80 00 80  00 80 00 80  ........               146.1.24
  60.1  ISOC   0c 8d 80 02  b5 05 e5 20  .......                147.1.0
               b8 05 15 01  00 80 00 80  ........               147.1.8
               00 80 00 80  00 80 00 80  ........               147.1.16
               00 80 00 80  00 80 00 80  ........               147.1.24
  60.1  ISOC   0c 8d 80 02  b5 05 65 ca  ......e.               148.1.0
               bb 05 25 01  00 80 00 80  ..%.....               148.1.8
               00 80 00 80  00 80 00 80  ........               148.1.16
               00 80 00 80  00 80 00 80  ........               148.1.24
  60.1  ISOC   0c 8c 60 97  bc 05 e5 73  ..`....s               149.1.0
               bf 05 35 01  00 80 00 80  ..5.....               149.1.8
               00 80 00 80  00 80 00 80  ........               149.1.16
               00 80 00 80  00 80 00 80  ........               149.1.24
  60.1  ISOC   0c 8c 60 97  bc 05 65 1d  ..`...e.               150.1.0
               c3 05 45 01  00 80 00 80  ..E.....               150.1.8
               00 80 00 80  00 80 00 80  ........               150.1.16
               00 80 00 80  00 80 00 80  ........               150.1.24
  60.1  ISOC   0c 8d 60 2c  c4 05 e5 c6  ..`,....               151.1.0
               c6 05 55 01  00 80 00 80  ..U.....               151.1.8
               00 80 00 80  00 80 00 80  ........               151.1.16
               00 80 00 80  00 80 00 80  ........               151.1.24
  60.1  ISOC   0c 8d 60 2c  c4 05 65 70  ..`,..ep               152.1.0
               ca 05 65 01  00 80 00 80  ..e.....               152.1.8
               00 80 00 80  00 80 00 80  ........               152.1.16
               00 80 00 80  00 80 00 80  ........               152.1.24
  60.1  ISOC   0c 8c a0 c8  cb 05 e5 19  ........               153.1.0
               ce 05 75 01  00 00 00 00  ..u.....               153.1.8
               00 00 00 00  00 00 00 00  ........               153.1.16
               00 00 00 00  00 00 00 00  ........               153.1.24
