Bus Hound 6.01 capture on Windows Vista (x64). Complements of www.perisoft.net

c2

  Device - Device ID (followed by the endpoint for USB devices)
            (50) USB Camera
            (51) USB Camera
            (53) USB Camera
  Phase  - Phase Type
            CTL   USB control transfer       OUT   Data out transfer
            IN    Data in transfer           RESET bus reset
            ISOC  Isochronous transfer       USTS  USB status
  Data   - Hex dump of the data transferred
  Descr  - Description of the phase
  Cmd... - Position in the captured data


Device  Phase  Data                      Description       Cmd.Phase.Ofs(rep)
------  -----  ------------------------  ----------------  ------------------
  53.0  CTL    a1 81 00 01  01 00 1a 00  GET CUR                108.1.0        
  53.0  IN     00 00 01 01  15 16 05 00  ........               108.2.0        
               00 00 00 00  00 00 00 00  ........               108.2.8        
               20 00 00 48  3f 00 00 0c   ..H?...               108.2.16       
               00 00                     ..                     108.2.24       
  53.0  CTL    21 01 00 01  01 00 1a 00  SET CUR                109.1.0        
  53.0  OUT    00 00 01 01  15 16 05 00  ........               109.2.0        
               00 00 00 00  00 00 00 00  ........               109.2.8        
               20 00 00 48  3f 00 00 00   ..H?...               109.2.16       
               00 00                     ..                     109.2.24       
  53.0  CTL    a1 81 00 01  01 00 1a 00  GET CUR                110.1.0        
  53.0  IN     00 00 01 01  15 16 05 00  ........               110.2.0        
               00 00 00 00  00 00 00 00  ........               110.2.8        
               20 00 00 48  3f 00 00 0c   ..H?...               110.2.16       
               00 00                     ..                     110.2.24       
  53.0  CTL    a1 83 00 01  01 00 1a 00  GET MAX                111.1.0        
  53.0  IN     00 00 01 01  15 16 05 00  ........               111.2.0        
               00 00 00 00  00 00 00 00  ........               111.2.8        
               20 00 00 48  3f 00 00 0c   ..H?...               111.2.16       
               00 00                     ..                     111.2.24       
  53.0  CTL    a1 82 00 01  01 00 1a 00  GET MIN                112.1.0        
  53.0  IN     00 00 01 01  15 16 05 00  ........               112.2.0        
               00 00 00 00  00 00 00 00  ........               112.2.8        
               20 00 00 48  3f 00 00 0c   ..H?...               112.2.16       
               00 00                     ..                     112.2.24       
  53.0  CTL    21 01 00 01  01 00 1a 00  SET CUR                113.1.0        
  53.0  OUT    00 00 01 01  15 16 05 00  ........               113.2.0        
               00 00 00 00  00 00 00 00  ........               113.2.8        
               20 00 00 48  3f 00 00 00   ..H?...               113.2.16       
               00 00                     ..                     113.2.24       
  53.0  CTL    a1 81 00 01  01 00 1a 00  GET CUR                114.1.0        
  53.0  IN     00 00 01 01  15 16 05 00  ........               114.2.0        
               00 00 00 00  00 00 00 00  ........               114.2.8        
               20 00 00 48  3f 00 00 0c   ..H?...               114.2.16       
               00 00                     ..                     114.2.24       
  53.0  CTL    21 01 00 02  01 00 1a 00  SET CUR                115.1.0        
  53.0  OUT    00 00 01 01  15 16 05 00  ........               115.2.0        
               00 00 00 00  00 00 00 00  ........               115.2.8        
               20 00 00 48  3f 00 00 0c   ..H?...               115.2.16       
               00 00                     ..                     115.2.24       
  53.0  CTL    01 0b 07 00  01 00 00 00  SET INTERFACE          116.1.0        
