Bus Hound 6.01 capture on Windows Vista (x64). Complements of www.perisoft.net

c3

  Device - Device ID (followed by the endpoint for USB devices)
            (50) USB Camera
            (51) USB Camera
            (53) USB Camera
            (55) 3D Webcam
            (57) USB2.0 PC CAMERA
  Phase  - Phase Type
            CTL   USB control transfer       
            IN    Data in transfer           
            ISOC  Isochronous transfer       
            OUT   Data out transfer          
            RESET bus reset                  
  Data   - Hex dump of the data transferred
  Descr  - Description of the phase
  Cmd... - Position in the captured data


Device  Phase  Data                      Description       Cmd.Phase.Ofs(rep)
------  -----  ------------------------  ----------------  ------------------
  57.0  CTL    a1 81 00 02  00 02 02 00  GET CUR                  1.1.0        
  57.0  IN     80 00                     ..                       1.2.0        
  57.0  CTL    a1 81 00 05  00 02 01 00  GET CUR                  2.1.0(5)     
  57.0  IN     01                        .                        2.2.0        
  57.0  CTL    21 01 00 05  00 02 01 00  SET CUR                  7.1.0        
  57.0  OUT    02                        .                        7.2.0        
  57.0  CTL    a1 81 00 05  00 02 01 00  GET CUR                  8.1.0        
  57.0  IN     02                        .                        8.2.0        
  57.0  CTL    a1 81 00 01  00 02 02 00  GET CUR                  9.1.0(2)     
  57.0  IN     01 00                     ..                       9.2.0        
  57.0  CTL    a1 81 00 02  00 02 02 00  GET CUR                 11.1.0(2)     
  57.0  IN     80 00                     ..                      11.2.0        
  57.0  CTL    a1 81 00 03  00 02 02 00  GET CUR                 13.1.0(2)     
  57.0  IN     82 00                     ..                      13.2.0        
  57.0  CTL    a1 81 00 06  00 02 02 00  GET CUR                 15.1.0(2)     
  57.0  IN     00 00                     ..                      15.2.0        
  57.0  CTL    a1 81 00 01  01 00 1a 00  GET CUR                 17.1.0        
  57.0  IN     00 00 01 01  15 16 05 00  ........                17.2.0        
               00 00 00 00  00 00 00 00  ........                17.2.8        
               00 00 00 60  09 00 00 0c  ...`....                17.2.16       
               00 00                     ..                      17.2.24       
  57.0  CTL    21 01 00 01  01 00 1a 00  SET CUR                 18.1.0        
  57.0  OUT    00 00 01 01  15 16 05 00  ........                18.2.0        
               00 00 00 00  00 00 00 00  ........                18.2.8        
               00 00 00 60  09 00 00 00  ...`....                18.2.16       
               00 00                     ..                      18.2.24       
  57.0  CTL    a1 81 00 01  01 00 1a 00  GET CUR                 19.1.0        
  57.0  IN     00 00 01 01  15 16 05 00  ........                19.2.0        
               00 00 00 00  00 00 00 00  ........                19.2.8        
               00 00 00 60  09 00 00 0c  ...`....                19.2.16       
               00 00                     ..                      19.2.24       
  57.0  CTL    a1 83 00 01  01 00 1a 00  GET MAX                 20.1.0        
  57.0  IN     00 00 01 01  15 16 05 00  ........                20.2.0        
               00 00 00 00  00 00 00 00  ........                20.2.8        
               00 00 00 60  09 00 00 0c  ...`....                20.2.16       
               00 00                     ..                      20.2.24       
  57.0  CTL    a1 82 00 01  01 00 1a 00  GET MIN                 21.1.0        
  57.0  IN     00 00 01 01  15 16 05 00  ........                21.2.0        
               00 00 00 00  00 00 00 00  ........                21.2.8        
               00 00 00 60  09 00 00 0c  ...`....                21.2.16       
               00 00                     ..                      21.2.24       
  57.0  CTL    21 01 00 01  01 00 1a 00  SET CUR                 22.1.0        
  57.0  OUT    00 00 01 01  15 16 05 00  ........                22.2.0        
               00 00 00 00  00 00 00 00  ........                22.2.8        
               00 00 00 60  09 00 00 00  ...`....                22.2.16       
               00 00                     ..                      22.2.24       
  57.0  CTL    a1 81 00 01  01 00 1a 00  GET CUR                 23.1.0        
  57.0  IN     00 00 01 01  15 16 05 00  ........                23.2.0        
               00 00 00 00  00 00 00 00  ........                23.2.8        
               00 00 00 60  09 00 00 0c  ...`....                23.2.16       
               00 00                     ..                      23.2.24       
  57.0  CTL    21 01 00 02  01 00 1a 00  SET CUR                 24.1.0        
  57.0  OUT    00 00 01 01  15 16 05 00  ........                24.2.0        
               00 00 00 00  00 00 00 00  ........                24.2.8        
               00 00 00 60  09 00 00 0c  ...`....                24.2.16       
               00 00                     ..                      24.2.24       
  57.0  CTL    01 0b 01 00  01 00 00 00  SET INTERFACE           25.1.0        
  57    ISOC                                                     26.1.0        
  57.0  CTL    a1 81 00 02  00 02 02 00  GET CUR                 27.1.0(2)     
  57.0  IN     80 00                     ..                      27.2.0        
  57.0  CTL    21 01 00 02  00 02 02 00  SET CUR                 28.1.0(2)     
  57.0  OUT    80 00                     ..                      28.2.0        
  57.0  CTL    a1 81 00 02  00 02 02 00  GET CUR                 29.1.0(2)     
  57.0  IN     80 00                     ..                      29.2.0        
  57    ISOC                                                     33.1.0(32)    
  57.2  ISOC   00 00 00 00  00 00 00 00  ........                65.1.0        
               00 00 00 00  00 00 00 00  ........                65.1.8        
               00 00 00 00  00 00 00 00  ........                65.1.16       
               00 00 00 00  00 00 00 00  ........                65.1.24       
  57.2  ISOC   0c 0c 00 00  00 00 53 a0  ......S.                66.1.0        
               8a 3e fe 00  10 7f 11 77  .>.....w                66.1.8        
               10 7e 11 77  10 81 10 78  ...w...x                66.1.16       
               10 84 10 78  10 84 10 78  ...x...x                66.1.24       
  57.2  ISOC   0c 0c 00 00  00 00 1b a5  ........                67.1.0        
               97 3e 0e 01  1a 86 1a 71  .>.....q                67.1.8        
               1b 84 1b 6e  1b 82 1b 70  ...n...p                67.1.16       
               1b 84 1c 70  1a 88 1b 71  ...p...q                67.1.24       
  57    ISOC                                                     68.1.0(6)     
  57.2  ISOC   00 00 00 00  00 00 00 00  ........                74.1.0        
               00 00 00 00  00 00 00 00  ........                74.1.8        
               00 00 00 00  00 00 00 00  ........                74.1.16       
               00 00 00 00  00 00 00 00  ........                74.1.24       
  57.2  ISOC   0c 0d 85 6a  a0 3e 96 cb  ...j.>..                75.1.0        
               ff 3e 8e 01  21 8c 21 6c  .>..!.!l                75.1.8        
               23 8e 22 6a  23 91 23 6b  #."j#.#k                75.1.16       
               23 93 23 6c  23 93 23 6b  #.#l#.#k                75.1.24       
  57.2  ISOC   0c 0d 85 6a  a0 3e ce d0  ...j.>..                76.1.0        
               0c 3f 9e 01  1d 84 1d 79  .?.....y                76.1.8        
               1d 84 1d 78  1d 84 1d 79  ...x...y                76.1.16       
               1d 83 1d 7b  1d 84 1d 79  .......y                76.1.24       
  57    ISOC                                                     77.1.0(5)     
  57.2  ISOC   0c 0c 00 00  00 00 53 a0  ......S.                82.1.0        
               8a 3e fe 00  10 7f 11 77  .>.....w                82.1.8        
               10 7e 11 77  10 81 10 78  ...w...x                82.1.16       
               10 84 10 78  10 84 10 78  ...x...x                82.1.24       
  57.2  ISOC   0c 0c 8a 47  0e 3f 2b f6  ...G.?+.                83.1.0        
               67 3f 0e 02  1d 91 1c 6c  g?.....l                83.1.8        
               1c 94 1c 6d  1c 90 1b 6c  ...m...l                83.1.16       
               1d 91 1d 69  1d 93 1d 6b  ...i...k                83.1.24       
  57.2  ISOC   0c 0c 8a 47  0e 3f 8b fb  ...G.?..                84.1.0        
               74 3f 1e 02  19 8a 19 72  t?.....r                84.1.8        
               19 89 19 70  19 88 19 70  ...p...p                84.1.16       
               19 8c 18 6f  16 8e 17 73  ...o...s                84.1.24       
  57    ISOC                                                     85.1.0(5)     
  57.2  ISOC   00 00 00 00  00 00 00 00  ........                90.1.0        
               00 00 00 00  00 00 00 00  ........                90.1.8        
               00 00 00 00  00 00 00 00  ........                90.1.16       
               00 00 00 00  00 00 00 00  ........                90.1.24       
  57.2  ISOC   0c 0d 85 24  7c 3f a6 26  ...$.?.&                91.1.0        
               d0 3f 8e 02  10 87 10 79  .?.....y                91.1.8        
               10 87 10 79  10 86 10 79  ...y...y                91.1.16       
               10 86 10 7a  10 87 10 79  ...z...y                91.1.24       
  57.2  ISOC   0c 0d 85 24  7c 3f 26 2b  ...$.?&+                92.1.0        
               dd 3f 9e 02  15 8f 15 73  .?.....s                92.1.8        
               15 8e 15 73  15 8e 15 73  ...s...s                92.1.16       
               15 8f 15 73  17 90 17 73  ...s...s                92.1.24       
  57    ISOC                                                     93.1.0(6)     
  57.2  ISOC   0c 0c 8a 47  0e 3f 2b f6  ...G.?+.                99.1.0        
               67 3f 0e 02  1d 91 1c 6c  g?.....l                99.1.8        
               1c 94 1c 6d  1c 90 1b 6c  ...m...l                99.1.16       
               1d 91 1d 69  1d 93 1d 6b  ...i...k                99.1.24       
  57.2  ISOC   0c 0c 87 01  ea 3f fb 51  .....?.Q               100.1.0        
               45 40 1e 03  13 8d 12 76  E@.....v               100.1.8        
               13 8e 13 75  14 8c 14 76  ...u...v               100.1.16       
               15 8b 13 78  15 8f 13 77  ...x...w               100.1.24       
  57.2  ISOC   0c 0c 87 01  ea 3f cb 56  .....?.V               101.1.0        
               52 40 2e 03  16 91 17 72  R@.....r               101.1.8        
               18 8f 18 6f  16 90 17 72  ...o...r               101.1.16       
               17 8e 17 73  17 8a 17 73  ...s...s               101.1.24       
  57    ISOC                                                    102.1.0(5)     
  57.2  ISOC   0c 0d 85 24  7c 3f a6 26  ...$.?.&               107.1.0        
               d0 3f 8e 02  10 87 10 79  .?.....y               107.1.8        
               10 87 10 79  10 86 10 79  ...y...y               107.1.16       
               10 86 10 7a  10 87 10 79  ...z...y               107.1.24       
  57.2  ISOC   0c 0d 84 de  57 40 de 7a  ....W@.z               108.1.0        
               ad 40 9e 03  1c 90 1b 6e  .@.....n               108.1.8        
               1b 92 1c 6c  1b 96 1d 6c  ...l...l               108.1.16       
               1b 99 1c 6d  1a 9a 1c 6e  ...m...n               108.1.24       
  57.2  ISOC   0c 0d 84 de  57 40 4e 80  ....W@N.               109.1.0        
               ba 40 ae 03  27 a2 28 64  .@..'.(d               109.1.8        
               27 a4 27 64  27 a4 28 63  '.'d'.(c               109.1.16       
               27 a4 27 64  26 a4 26 64  '.'d&.&d               109.1.24       
  57    ISOC                                                    110.1.0(6)     
  57.2  ISOC   0c 0c 87 01  ea 3f fb 51  .....?.Q               116.1.0        
               45 40 1e 03  13 8d 12 76  E@.....v               116.1.8        
               13 8e 13 75  14 8c 14 76  ...u...v               116.1.16       
               15 8b 13 78  15 8f 13 77  ...x...w               116.1.24       
  57.2  ISOC   0c 0c 86 bb  c5 40 33 b0  .....@3.               117.1.0        
               22 41 2e 04  13 92 15 75  "A.....u               117.1.8        
               15 8d 15 75  15 8c 14 73  ...u...s               117.1.16       
               14 91 14 73  14 94 14 73  ...s...s               117.1.24       
  57.2  ISOC   0c 0c 86 bb  c5 40 8b b5  .....@..               118.1.0        
               2f 41 3e 04  15 8e 16 75  /A>....u               118.1.8        
               15 8d 16 76  15 8a 15 77  ...v...w               118.1.16       
               15 89 15 78  15 89 15 78  ...x...x               118.1.24       
  57    ISOC                                                    119.1.0(5)     
  57.2  ISOC   0c 0d 84 de  57 40 de 7a  ....W@.z               124.1.0        
               ad 40 9e 03  1c 90 1b 6e  .@.....n               124.1.8        
               1b 92 1c 6c  1b 96 1d 6c  ...l...l               124.1.16       
               1b 99 1c 6d  1a 9a 1c 6e  ...m...n               124.1.24       
  57.2  ISOC   0c 0d 85 98  33 41 56 d8  ....3AV.               125.1.0        
               8a 41 ae 04  10 8a 10 7a  .A.....z               125.1.8        
               10 89 10 7b  10 89 10 7a  .......z               125.1.16       
               10 8c 10 79  10 8c 10 79  ...y...y               125.1.24       
  57.2  ISOC   0c 0d 85 98  33 41 26 dd  ....3A&.               126.1.0        
               97 41 be 04  15 8d 16 74  .A.....t               126.1.8        
               15 8d 17 73  16 8d 16 72  ...s...r               126.1.16       
               16 8e 16 73  16 90 16 75  ...s...u               126.1.24       
  57    ISOC                                                    127.1.0(6)     
  57.2  ISOC   0c 0c 86 bb  c5 40 33 b0  .....@3.               133.1.0        
               22 41 2e 04  13 92 15 75  "A.....u               133.1.8        
               15 8d 15 75  15 8c 14 73  ...u...s               133.1.16       
               14 91 14 73  14 94 14 73  ...s...s               133.1.24       
  57.2  ISOC   0c 0c 88 75  a1 41 6b 05  ...u.Ak.               134.1.0        
               00 42 3e 05  22 a3 23 65  .B>.".#e               134.1.8        
               22 a5 23 65  22 a2 22 68  ".#e"."h               134.1.16       
               22 a1 23 67  23 9f 23 65  ".#g#.#e               134.1.24       
  57.2  ISOC   0c 0c 88 75  a1 41 b3 0a  ...u.A..               135.1.0        
               0d 42 4e 05  1d 99 1c 6c  .BN....l               135.1.8        
               1c 99 1c 6e  1d 99 1c 6c  ...n...l               135.1.16       
               1c 99 1d 6d  1d 96 1c 6e  ...m...n               135.1.24       
  57    ISOC                                                    136.1.0(5)     
  57.2  ISOC   0c 0d 85 98  33 41 56 d8  ....3AV.               141.1.0        
               8a 41 ae 04  10 8a 10 7a  .A.....z               141.1.8        
               10 89 10 7b  10 89 10 7a  .......z               141.1.16       
               10 8c 10 79  10 8c 10 79  ...y...y               141.1.24       
  57.2  ISOC   0c 0d 85 52  0f 42 de 30  ...R.B.0               142.1.0        
               68 42 be 05  12 8c 11 76  hB.....v               142.1.8        
               11 8d 11 76  10 8b 10 76  ...v...v               142.1.16       
               10 8d 10 76  11 8f 10 75  ...v...u               142.1.24       
  57.2  ISOC   0c 0d 85 52  0f 42 62 36  ...R.Bb6               143.1.0        
               75 42 ce 05  15 8b 15 73  uB.....s               143.1.8        
               17 88 16 74  16 8b 16 75  ...t...u               143.1.16       
               15 8c 15 77  14 8e 14 77  ...w...w               143.1.24       
  57    ISOC                                                    144.1.0(6)     
  57.2  ISOC   0c 0c 88 75  a1 41 6b 05  ...u.Ak.               150.1.0        
               00 42 3e 05  22 a3 23 65  .B>.".#e               150.1.8        
               22 a5 23 65  22 a2 22 68  ".#e"."h               150.1.16       
               22 a1 23 67  23 9f 23 65  ".#g#.#e               150.1.24       
  57.2  ISOC   0c 0c 8a 2f  7d 42 8b 63  .../.B.c               151.1.0        
               dd 42 4e 06  15 8e 16 74  .BN....t               151.1.8        
               16 8d 17 74  17 8c 17 74  ...t...t               151.1.16       
               17 8d 17 73  17 8e 17 73  ...s...s               151.1.24       
  57.2  ISOC   0c 0c 8a 2f  7d 42 5b 68  .../.B[h               152.1.0        
               ea 42 5e 06  18 86 17 8c  .B^.....               152.1.8        
               18 88 17 8e  19 83 18 92  ........               152.1.16       
               19 82 19 8c  19 82 19 8e  ........               152.1.24       
  57    ISOC                                                    153.1.0(5)     
  57.2  ISOC   0c 0d 85 52  0f 42 de 30  ...R.B.0               158.1.0        
               68 42 be 05  12 8c 11 76  hB.....v               158.1.8        
               11 8d 11 76  10 8b 10 76  ...v...v               158.1.16       
               10 8d 10 76  11 8f 10 75  ...v...u               158.1.24       
  57.2  ISOC   0c 0d 85 0c  eb 42 8e 8a  .....B..               159.1.0        
               45 43 ce 06  1d 9b 1d 6c  EC.....l               159.1.8        
               1d 9c 1e 6b  1e 9c 1e 6b  ...k...k               159.1.16       
               1e 9d 1d 6b  1e 9f 1e 6a  ...k...j               159.1.24       
  57.2  ISOC   0c 0d 85 0c  eb 42 de 8f  .....B..               160.1.0        
               52 43 de 06  1e a3 1e 6c  RC.....l               160.1.8        
               1f a1 1f 6b  20 9f 1f 68  ...k ..h               160.1.16       
               1f a0 1d 6b  1d a0 1e 6e  ...k...n               160.1.24       
  57    ISOC                                                    161.1.0(5)     
  57.2  ISOC   0c 0c 88 75  a1 41 6b 05  ...u.Ak.               166.1.0        
               00 42 3e 05  22 a3 23 65  .B>.".#e               166.1.8        
               22 a5 23 65  22 a2 22 68  ".#e"."h               166.1.16       
               22 a1 23 67  23 9f 23 65  ".#g#.#e               166.1.24       
  57.2  ISOC   0c 0c 8b e9  58 43 5b b5  ....XC[.               167.1.0        
               ad 43 4e 07  10 8e 10 7d  .CN.....               167.1.8        
               10 8b 10 7d  10 8b 10 7e  ........               167.1.16       
               10 86 10 7d  10 87 10 7c  ........               167.1.24       
  57.2  ISOC   0c 0c 8b e9  58 43 eb ba  ....XC..               168.1.0        
               ba 43 5e 07  10 8b 10 7a  .C^....z               168.1.8        
               10 8b 10 7a  10 8a 10 7a  ...z...z               168.1.16       
               10 88 10 79  10 89 10 78  ...y...x               168.1.24       
  57    ISOC                                                    169.1.0(6)     
  57.2  ISOC   0c 0d 85 0c  eb 42 8e 8a  .....B..               175.1.0        
               45 43 ce 06  1d 9b 1d 6c  EC.....l               175.1.8        
               1d 9c 1e 6b  1e 9c 1e 6b  ...k...k               175.1.16       
               1e 9d 1d 6b  1e 9f 1e 6a  ...k...j               175.1.24       
  57.2  ISOC   0c 0d 85 c6  c6 43 e6 e9  .....C..               176.1.0        
               22 44 de 07  13 93 13 75  "D.....u               176.1.8        
               13 91 13 76  15 8e 14 75  ...v...u               176.1.16       
               14 8f 15 74  13 8e 13 76  ...t...v               176.1.24       
  57.2  ISOC   0c 0d 85 c6  c6 43 b6 ee  .....C..               177.1.0        
               2f 44 ee 07  16 8e 16 75  /D.....u               177.1.8        
               16 8d 16 75  15 8d 16 74  ...u...t               177.1.16       
               15 8e 16 75  16 8d 15 75  ...u...u               177.1.24       
  57    ISOC                                                    178.1.0(5)     
  57.2  ISOC   0c 0c 8b e9  58 43 5b b5  ....XC[.               183.1.0        
               ad 43 4e 07  10 8e 10 7d  .CN.....               183.1.8        
               10 8b 10 7d  10 8b 10 7e  ........               183.1.16       
               10 86 10 7d  10 87 10 7c  ........               183.1.24       
  57.2  ISOC   0c 0c 8a a3  34 44 6b 10  ....4Dk.               184.1.0        
               8b 44 5e 00  13 91 14 76  .D^....v               184.1.8        
               14 91 13 74  12 94 13 74  ...t...t               184.1.16       
               12 95 14 72  12 94 12 73  ...r...s               184.1.24       
  57.2  ISOC   0c 0c 8a a3  34 44 3b 15  ....4D;.               185.1.0        
               98 44 6e 00  17 97 16 70  .Dn....p               185.1.8        
               16 98 17 70  17 97 17 71  ...p...q               185.1.16       
               18 97 1a 71  18 96 1a 72  ...q...r               185.1.24       
  57    ISOC                                                    186.1.0(6)     
  57.2  ISOC   0c 0d 85 c6  c6 43 e6 e9  .....C..               192.1.0        
               22 44 de 07  13 93 13 75  "D.....u               192.1.8        
               13 91 13 76  15 8e 14 75  ...v...u               192.1.16       
               14 8f 15 74  13 8e 13 76  ...t...v               192.1.24       
  57.2  ISOC   0c 0d 88 80  a2 44 be 3f  .....D.?               193.1.0        
               00 45 ee 00  21 9e 21 69  .E..!.!i               193.1.8        
               22 a0 22 67  22 9d 22 67  "."g"."g               193.1.16       
               23 99 23 6a  22 9a 22 69  #.#j"."i               193.1.24       
  57.2  ISOC   0c 0d 88 80  a2 44 0e 45  .....D.E               194.1.0        
               0d 45 fe 00  16 92 16 71  .E.....q               194.1.8        
               16 92 17 72  17 92 17 72  ...r...r               194.1.16       
               17 94 17 72  17 94 17 72  ...r...r               194.1.24       
  57    ISOC                                                    195.1.0(5)     
  57.2  ISOC   0c 0c 8a a3  34 44 6b 10  ....4Dk.               200.1.0        
               8b 44 5e 00  13 91 14 76  .D^....v               200.1.8        
               14 91 13 74  12 94 13 74  ...t...t               200.1.16       
               12 95 14 72  12 94 12 73  ...r...s               200.1.24       
  57.2  ISOC   0c 0c 8a 5d  10 45 63 6f  ...].Eco               201.1.0        
               68 45 6e 01  10 88 10 7a  hEn....z               201.1.8        
               10 88 10 7b  10 87 10 7a  .......z               201.1.16       
               10 86 10 7b  10 84 10 7c  ........               201.1.24       
  57.2  ISOC   0c 0c 8a 5d  10 45 ab 74  ...].E.t               202.1.0        
               75 45 7e 01  14 92 14 75  uE.....u               202.1.8        
               15 8f 15 73  15 8f 16 74  ...s...t               202.1.16       
               16 8e 16 75  16 90 14 76  ...u...v               202.1.24       
  57    ISOC                                                    203.1.0(6)     
  57.2  ISOC   0c 0d 88 80  a2 44 be 3f  .....D.?               209.1.0        
               00 45 ee 00  21 9e 21 69  .E..!.!i               209.1.8        
               22 a0 22 67  22 9d 22 67  "."g"."g               209.1.16       
               23 99 23 6a  22 9a 22 69  #.#j"."i               209.1.24       
  57.2  ISOC   0c 0d 87 3a  7e 45 96 9b  ...:.E..               210.1.0        
               dd 45 fe 01  15 8d 14 73  .E.....s               210.1.8        
               14 8f 14 74  14 90 13 76  ...t...v               210.1.16       
               14 90 14 75  15 8f 15 73  ...u...s               210.1.24       
  57.2  ISOC   0c 0d 87 3a  7e 45 66 a0  ...:.Ef.               211.1.0        
               ea 45 0e 02  17 87 17 8a  .E......               211.1.8        
               17 87 17 89  17 8a 17 89  ........               211.1.16       
               16 89 16 8b  16 89 17 88  ........               211.1.24       
  57    ISOC                                                    212.1.0(5)     
  57.2  ISOC   0c 0c 8a 5d  10 45 63 6f  ...].Eco               217.1.0        
               68 45 6e 01  10 88 10 7a  hEn....z               217.1.8        
               10 88 10 7b  10 87 10 7a  .......z               217.1.16       
               10 86 10 7b  10 84 10 7c  ........               217.1.24       
  57.2  ISOC   0c 0c 87 17  ec 45 73 c4  .....Es.               218.1.0        
               45 46 7e 02  1d 9c 1d 6b  EF.....k               218.1.8        
               1d 9c 1b 6c  1d 9d 1c 6e  ...l...n               218.1.16       
               1d 9c 1e 6c  1e 98 1e 6b  ...l...k               218.1.24       
  57.2  ISOC   0c 0c 87 17  ec 45 db c9  .....E..               219.1.0        
               52 46 8e 02  22 99 20 6d  RF..". m               219.1.8        
               20 99 21 6f  1f 97 20 71   .!o.. q               219.1.16       
               1f 98 1f 70  1f 98 1f 6d  ...p...m               219.1.24       
  57    ISOC                                                    220.1.0(5)     
  57.2  ISOC   0c 0d 88 80  a2 44 be 3f  .....D.?               225.1.0        
               00 45 ee 00  21 9e 21 69  .E..!.!i               225.1.8        
               22 a0 22 67  22 9d 22 67  "."g"."g               225.1.16       
               23 99 23 6a  22 9a 22 69  #.#j"."i               225.1.24       
  57.2  ISOC   0c 0d 85 f4  59 46 26 f6  ....YF&.               226.1.0        
               ad 46 fe 02  10 85 10 7b  .F......               226.1.8        
               10 87 10 7a  10 89 10 7a  ...z...z               226.1.16       
               10 89 10 7b  10 88 10 7b  ........               226.1.24       
  57.2  ISOC   0c 0d 85 f4  59 46 be f9  ....YF..               227.1.0        
               ba 46 0e 03  15 8d 14 74  .F.....t               227.1.8        
               15 8f 15 73  16 8d 15 75  ...s...u               227.1.16       
               16 8f 15 77  15 92 14 76  ...w...v               227.1.24       
  57    ISOC                                                    228.1.0(6)     
  57.2  ISOC   0c 0c 87 17  ec 45 73 c4  .....Es.               234.1.0        
               45 46 7e 02  1d 9c 1d 6b  EF.....k               234.1.8        
               1d 9c 1b 6c  1d 9d 1c 6e  ...l...n               234.1.16       
               1d 9c 1e 6c  1e 98 1e 6b  ...l...k               234.1.24       
  57.2  ISOC   0c 0c 88 d1  c7 46 fb 21  .....F.!               235.1.0        
               23 47 8e 03  13 94 13 78  #G.....x               235.1.8        
               14 90 16 75  15 8c 15 75  ...u...u               235.1.16       
               15 8d 13 75  12 8c 12 76  ...u...v               235.1.24       
  57.2  ISOC   0c 0c 88 d1  c7 46 cb 26  .....F.&               236.1.0        
               30 47 9e 03  16 8d 16 76  0G.....v               236.1.8        
               15 8e 16 76  14 91 16 76  ...v...v               236.1.16       
               14 91 16 76  16 90 16 76  ...v...v               236.1.24       
  57    ISOC                                                    237.1.0(5)     
  57.2  ISOC   0c 0d 85 f4  59 46 26 f6  ....YF&.               242.1.0        
               ad 46 fe 02  10 85 10 7b  .F......               242.1.8        
               10 87 10 7a  10 89 10 7a  ...z...z               242.1.16       
               10 89 10 7b  10 88 10 7b  ........               242.1.24       
  57.2  ISOC   0c 0d 87 ae  35 47 a6 49  ....5G.I               243.1.0        
               8b 47 0e 04  1a 95 19 6e  .G.....n               243.1.8        
               1a 99 19 6f  19 9c 19 70  ...o...p               243.1.16       
               19 9b 19 70  1a 97 19 6f  ...p...o               243.1.24       
  57.2  ISOC   0c 0d 87 ae  35 47 ee 4e  ....5G.N               244.1.0        
               98 47 1e 04  1c 9d 1c 70  .G.....p               244.1.8        
               1c 9d 1d 6f  1d 9c 1d 6c  ...o...l               244.1.16       
               1c 9e 1c 6e  1c 9f 1e 6f  ...n...o               244.1.24       
  57    ISOC                                                    245.1.0(6)     
  57.2  ISOC   0c 0c 88 d1  c7 46 fb 21  .....F.!               251.1.0        
               23 47 8e 03  13 94 13 78  #G.....x               251.1.8        
               14 90 16 75  15 8c 15 75  ...u...u               251.1.16       
               15 8d 13 75  12 8c 12 76  ...u...v               251.1.24       
  57.2  ISOC   0c 0c 86 8b  a3 47 5b 7a  .....G[z               252.1.0        
               00 48 9e 04  10 8f 10 78  .H.....x               252.1.8        
               10 8f 10 78  10 8f 10 78  ...x...x               252.1.16       
               10 8f 10 77  11 8d 11 76  ...w...v               252.1.24       
  57.2  ISOC   0c 0c 86 8b  a3 47 d6 7f  .....G..               253.1.0        
               0d 48 ae 04  13 8e 14 77  .H.....w               253.1.8        
               14 8b 15 75  14 8a 14 76  ...u...v               253.1.16       
               13 8c 13 78  13 8d 13 78  ...x...x               253.1.24       
  57    ISOC                                                    254.1.0(5)     
  57.2  ISOC   0c 0d 87 ae  35 47 a6 49  ....5G.I               259.1.0        
               8b 47 0e 04  1a 95 19 6e  .G.....n               259.1.8        
               1a 99 19 6f  19 9c 19 70  ...o...p               259.1.16       
               19 9b 19 70  1a 97 19 6f  ...p...o               259.1.24       
  57.2  ISOC   0c 0d 84 68  11 48 56 a8  ...h.HV.               260.1.0        
               68 48 1e 05  10 89 10 7a  hH.....z               260.1.8        
               10 89 10 7a  10 88 10 7a  ...z...z               260.1.16       
               10 88 10 7c  10 89 10 7c  ........               260.1.24       
  57.2  ISOC   0c 0d 84 68  11 48 26 ad  ...h.H&.               261.1.0        
               75 48 2e 05  14 91 16 75  uH.....u               261.1.8        
               14 91 15 75  14 94 15 74  ...u...t               261.1.16       
               15 8f 15 73  17 8d 15 72  ...s...r               261.1.24       
  57    ISOC                                                    262.1.0(6)     
  57.2  ISOC   0c 0c 86 8b  a3 47 5b 7a  .....G[z               268.1.0        
               00 48 9e 04  10 8f 10 78  .H.....x               268.1.8        
               10 8f 10 78  10 8f 10 78  ...x...x               268.1.16       
               10 8f 10 77  11 8d 11 76  ...w...v               268.1.24       
  57.2  ISOC   0c 0c 8a 45  7f 48 13 d4  ...E.H..               269.1.0        
               dd 48 ae 05  19 9e 1a 6d  .H.....m               269.1.8        
               19 9c 19 6e  17 99 17 70  ...n...p               269.1.16       
               18 99 18 71  17 97 17 71  ...q...q               269.1.24       
  57.2  ISOC   0c 0c 8a 45  7f 48 6b d9  ...E.Hk.               270.1.0        
               ea 48 be 05  17 96 18 70  .H.....p               270.1.8        
               18 93 18 70  18 93 18 70  ...p...p               270.1.16       
               18 94 17 71  17 97 17 71  ...q...q               270.1.24       
  57    ISOC                                                    271.1.0(5)     
  57.2  ISOC   0c 0d 84 68  11 48 56 a8  ...h.HV.               276.1.0        
               68 48 1e 05  10 89 10 7a  hH.....z               276.1.8        
               10 89 10 7a  10 88 10 7a  ...z...z               276.1.16       
               10 88 10 7c  10 89 10 7c  ........               276.1.24       
  57.2  ISOC   0c 0d 83 22  ed 48 de fe  ...".H..               277.1.0        
               45 49 2e 06  18 92 18 72  EI.....r               277.1.8        
               17 8f 17 74  17 8e 17 75  ...t...u               277.1.16       
               17 8c 18 73  18 8c 18 73  ...s...s               277.1.24       
  57.2  ISOC   0c 0d 83 22  ed 48 5e 04  ...".H^.               278.1.0        
               53 49 3e 06  11 88 11 7a  SI>....z               278.1.8        
               10 89 10 7b  10 88 10 7b  ........               278.1.16       
               10 87 10 7b  10 89 10 7c  ........               278.1.24       
  57    ISOC                                                    279.1.0(6)     
  57.2  ISOC   0c 0c 8a 45  7f 48 13 d4  ...E.H..               285.1.0        
               dd 48 ae 05  19 9e 1a 6d  .H.....m               285.1.8        
               19 9c 19 6e  17 99 17 70  ...n...p               285.1.16       
               18 99 18 71  17 97 17 71  ...q...q               285.1.24       
  57.2  ISOC   0c 0c 89 ff  5a 49 93 33  ....ZI.3               286.1.0        
               bb 49 be 06  16 8e 16 73  .I.....s               286.1.8        
               14 91 14 77  16 91 16 75  ...w...u               286.1.16       
               16 8e 17 75  16 8d 17 74  ...u...t               286.1.24       
  57.2  ISOC   0c 0c 89 ff  5a 49 5b 38  ....ZI[8               287.1.0        
               c8 49 ce 06  19 82 19 88  .I......               287.1.8        
               19 82 19 8b  1a 81 1a 8f  ........               287.1.16       
               1b 82 1a 90  1b 83 1a 8f  ........               287.1.24       
  57    ISOC                                                    288.1.0(5)     
  57.2  ISOC   0c 0d 83 22  ed 48 de fe  ...".H..               293.1.0        
               45 49 2e 06  18 92 18 72  EI.....r               293.1.8        
               17 8f 17 74  17 8e 17 75  ...t...u               293.1.16       
               17 8c 18 73  18 8c 18 73  ...s...s               293.1.24       
  57.2  ISOC   0c 0d 83 dc  c8 49 06 5a  .....I.Z               294.1.0        
               23 4a 3e 07  19 96 1a 72  #J>....r               294.1.8        
               18 94 1a 73  19 91 19 71  ...s...q               294.1.16       
               19 90 19 71  18 90 18 72  ...q...r               294.1.24       
  57.2  ISOC   0c 0d 83 dc  c8 49 d6 5e  .....I.^               295.1.0        
               30 4a 4e 07  1a 91 1a 72  0JN....r               295.1.8        
               19 94 18 73  1a 94 1a 72  ...s...r               295.1.16       
               1b 92 1a 71  1b 93 19 71  ...q...q               295.1.24       
  57    ISOC                                                    296.1.0(5)     
  57.2  ISOC   0c 0c 8a 45  7f 48 13 d4  ...E.H..               301.1.0        
               dd 48 ae 05  19 9e 1a 6d  .H.....m               301.1.8        
               19 9c 19 6e  17 99 17 70  ...n...p               301.1.16       
               18 99 18 71  17 97 17 71  ...q...q               301.1.24       
  57.2  ISOC   0c 0c 88 b9  36 4a b3 83  ....6J..               302.1.0        
               8b 4a be 07  1a 94 1a 6f  .J.....o               302.1.8        
               19 95 1a 6f  19 96 1a 6f  ...o...o               302.1.16       
               1a 97 1a 6e  1a 97 19 6f  ...n...o               302.1.24       
  57.2  ISOC   0c 0c 88 b9  36 4a 23 89  ....6J#.               303.1.0        
               98 4a ce 07  24 9c 24 6b  .J..$.$k               303.1.8        
               24 9e 26 6a  26 9d 25 68  $.&j&.%h               303.1.16       
               24 9c 25 68  23 9d 23 67  $.%h#.#g               303.1.24       
  57    ISOC                                                    304.1.0(6)     
  57.2  ISOC   0c 0d 83 dc  c8 49 06 5a  .....I.Z               310.1.0        
               23 4a 3e 07  19 96 1a 72  #J>....r               310.1.8        
               18 94 1a 73  19 91 19 71  ...s...q               310.1.16       
               19 90 19 71  18 90 18 72  ...q...r               310.1.24       
  57.2  ISOC   0c 0d 88 96  a4 4a e6 b8  .....J..               311.1.0        
               00 4b 4e 00  14 92 15 74  .KN....t               311.1.8        
               14 90 14 75  14 90 15 75  ...u...u               311.1.16       
               14 8f 14 74  13 90 13 76  ...t...v               311.1.24       
  57.2  ISOC   0c 0d 88 96  a4 4a 36 be  .....J6.               312.1.0        
               0d 4b 5e 00  15 89 14 75  .K^....u               312.1.8        
               15 8b 15 77  13 8c 15 78  ...w...x               312.1.16       
               15 8c 15 77  16 8b 15 76  ...w...v               312.1.24       
  57    ISOC                                                    313.1.0(5)     
  57.2  ISOC   0c 0c 88 b9  36 4a b3 83  ....6J..               318.1.0        
               8b 4a be 07  1a 94 1a 6f  .J.....o               318.1.8        
               19 95 1a 6f  19 96 1a 6f  ...o...o               318.1.16       
               1a 97 1a 6e  1a 97 19 6f  ...n...o               318.1.24       
  57.2  ISOC   0c 0c 89 73  12 4b 6b e0  ...s.Kk.               319.1.0        
               68 4b ce 00  10 87 10 78  hK.....x               319.1.8        
               10 89 10 78  10 87 11 7a  ...x...z               319.1.16       
               10 89 11 7b  10 8a 10 7b  ........               319.1.24       
  57.2  ISOC   0c 0c 89 73  12 4b 3b e5  ...s.K;.               320.1.0        
               75 4b de 00  18 91 18 71  uK.....q               320.1.8        
               18 92 16 73  16 95 16 75  ...s...u               320.1.16       
               16 94 16 74  16 92 17 73  ...t...s               320.1.24       
  57    ISOC                                                    321.1.0(6)     
  57.2  ISOC   0c 0d 88 96  a4 4a e6 b8  .....J..               327.1.0        
               00 4b 4e 00  14 92 15 74  .KN....t               327.1.8        
               14 90 14 75  14 90 15 75  ...u...u               327.1.16       
               14 8f 14 74  13 90 13 76  ...t...v               327.1.24       
  57.2  ISOC   0c 0d 85 50  80 4b 06 0e  ...P.K..               328.1.0        
               de 4b 5e 01  26 a5 26 64  .K^.&.&d               328.1.8        
               26 a4 25 67  25 a6 24 69  &.%g%.$i               328.1.16       
               25 a6 25 66  26 a6 25 64  %.%f&.%d               328.1.24       
  57.2  ISOC   0c 0d 85 50  80 4b 66 13  ...P.Kf.               329.1.0        
               eb 4b 6e 01  1b 9b 1c 6c  .Kn....l               329.1.8        
               1c 9c 1b 6e  1c 9c 1c 6d  ...n...m               329.1.16       
               1d 9b 1d 6c  1e 99 1d 6b  ...l...k               329.1.24       
  57    ISOC                                                    330.1.0(5)     
  57.2  ISOC   0c 0c 89 73  12 4b 6b e0  ...s.Kk.               335.1.0        
               68 4b ce 00  10 87 10 78  hK.....x               335.1.8        
               10 89 10 78  10 87 11 7a  ...x...z               335.1.16       
               10 89 11 7b  10 8a 10 7b  ........               335.1.24       
  57.2  ISOC   0c 0c 88 2d  ee 4b c5 39  ...-.K.9               336.1.0        
               46 4c de 01  10 8a 10 7b  FL......               336.1.8        
               10 8c 10 7a  10 8a 10 7b  ...z....               336.1.16       
               10 89 10 7a  10 8a 10 7a  ...z...z               336.1.24       
  57.2  ISOC   0c 0c 88 2d  ee 4b 53 43  ...-.KSC               337.1.0        
               53 4c ee 01  16 8d 16 75  SL.....u               337.1.8        
               15 8d 15 77  16 8e 16 76  ...w...v               337.1.16       
               16 90 16 75  16 90 16 75  ...u...u               337.1.24       
  57    ISOC                                                    338.1.0(6)     
  57.2  ISOC   0c 0d 85 50  80 4b 06 0e  ...P.K..               344.1.0        
               de 4b 5e 01  26 a5 26 64  .K^.&.&d               344.1.8        
               26 a4 25 67  25 a6 24 69  &.%g%.$i               344.1.16       
               25 a6 25 66  26 a6 25 64  %.%f&.%d               344.1.24       
  57.2  ISOC   0c 0d 86 0a  5c 4c 96 6b  ....\L.k               345.1.0        
               bb 4c 6e 02  15 98 14 73  .Ln....s               345.1.8        
               15 97 14 74  15 97 15 73  ...t...s               345.1.16       
               16 95 16 71  16 91 16 74  ...q...t               345.1.24       
  57.2  ISOC   0c 0d 86 0a  5c 4c 66 70  ....\Lfp               346.1.0        
               c8 4c 7e 02  15 85 15 88  .L......               346.1.8        
               15 87 15 87  15 88 15 88  ........               346.1.16       
               15 86 15 88  15 85 16 89  ........               346.1.24       
  57    ISOC                                                    347.1.0(5)     
  57.2  ISOC   0c 0c 88 2d  ee 4b c5 39  ...-.K.9               352.1.0        
               46 4c de 01  10 8a 10 7b  FL......               352.1.8        
               10 8c 10 7a  10 8a 10 7b  ...z....               352.1.16       
               10 89 10 7a  10 8a 10 7a  ...z...z               352.1.24       
  57.2  ISOC   0c 0c 87 e7  c9 4c 43 93  .....LC.               353.1.0        
               23 4d ee 02  1e 9b 1e 6b  #M.....k               353.1.8        
               1f 9b 1e 6a  1d 9b 1d 6c  ...j...l               353.1.16       
               1d 9c 1e 6c  1e 9b 1d 6c  ...l...l               353.1.24       
  57.2  ISOC   0c 0c 87 e7  c9 4c 83 98  .....L..               354.1.0        
               30 4d fe 02  1e 98 1f 6e  0M.....n               354.1.8        
               1f 98 20 6c  1f 99 1f 6e  .. l...n               354.1.16       
               1e 9b 1f 70  1e 9c 1f 70  ...p...p               354.1.24       
  57    ISOC                                                    355.1.0(5)     
  57.2  ISOC   0c 0d 85 50  80 4b 06 0e  ...P.K..               360.1.0        
               de 4b 5e 01  26 a5 26 64  .K^.&.&d               360.1.8        
               26 a4 25 67  25 a6 24 69  &.%g%.$i               360.1.16       
               25 a6 25 66  26 a6 25 64  %.%f&.%d               360.1.24       
  57.2  ISOC   0c 0d 85 c4  37 4d c6 c4  ....7M..               361.1.0        
               8b 4d 6e 03  10 87 10 7a  .Mn....z               361.1.8        
               10 87 10 7c  10 86 10 7c  ........               361.1.16       
               10 86 10 7b  10 88 10 79  .......y               361.1.24       
  57.2  ISOC   0c 0d 85 c4  37 4d e6 c3  ....7M..               362.1.0        
               98 4d 7e 03  12 8f 12 77  .M.....w               362.1.8        
               13 8f 13 76  14 8f 14 75  ...v...u               362.1.16       
               14 8b 14 76  13 8c 13 75  ...v...u               362.1.24       
  57    ISOC                                                    363.1.0(6)     
  57.2  ISOC   0c 0c 87 e7  c9 4c 43 93  .....LC.               369.1.0        
               23 4d ee 02  1e 9b 1e 6b  #M.....k               369.1.8        
               1f 9b 1e 6a  1d 9b 1d 6c  ...j...l               369.1.16       
               1d 9c 1e 6c  1e 9b 1d 6c  ...l...l               369.1.24       
  57.2  ISOC   0c 0c 89 a1  a5 4d fb f1  .....M..               370.1.0        
               00 4e fe 03  14 92 14 73  .N.....s               370.1.8        
               15 8f 14 73  14 90 15 75  ...s...u               370.1.16       
               15 8d 15 75  14 8b 12 75  ...u...u               370.1.24       
  57.2  ISOC   0c 0c 89 a1  a5 4d cb f6  .....M..               371.1.0        
               0d 4e 0e 04  16 91 17 74  .N.....t               371.1.8        
               17 90 17 75  17 8e 16 75  ...u...u               371.1.16       
               16 90 16 75  17 8f 17 73  ...u...s               371.1.24       
  57    ISOC                                                    372.1.0(5)     
  57.2  ISOC   0c 0d 85 c4  37 4d c6 c4  ....7M..               377.1.0        
               8b 4d 6e 03  10 87 10 7a  .Mn....z               377.1.8        
               10 87 10 7c  10 86 10 7c  ........               377.1.16       
               10 86 10 7b  10 88 10 79  .......y               377.1.24       
  57.2  ISOC   0c 0d 83 7e  13 4e 76 18  .....Nv.               378.1.0        
               69 4e 7e 04  15 90 14 73  iN.....s               378.1.8        
               15 90 14 73  14 90 13 76  ...s...v               378.1.16       
               13 92 13 77  14 97 14 75  ...w...u               378.1.24       
  57.2  ISOC   0c 0d 83 7e  13 4e ae 1d  .....N..               379.1.0        
               76 4e 8e 04  21 9d 22 6c  vN..!."l               379.1.8        
               20 a0 20 6d  1f a2 1f 6e   . m...n               379.1.16       
               1e a3 1f 6a  1e a1 1e 6b  ...j...k               379.1.24       
  57    ISOC                                                    380.1.0(6)     
  57.2  ISOC   0c 0c 89 a1  a5 4d fb f1  .....M..               386.1.0        
               00 4e fe 03  14 92 14 73  .N.....s               386.1.8        
               15 8f 14 73  14 90 15 75  ...s...u               386.1.16       
               15 8d 15 75  14 8b 12 75  ...u...u               386.1.24       
  57.2  ISOC   0c 0c 89 5b  81 4e 73 48  ...[.NsH               387.1.0        
               de 4e 0e 05  1b 93 1b 71  .N.....q               387.1.8        
               1a 95 1b 71  1b 93 1b 6e  ...q...n               387.1.16       
               1b 91 1a 6c  1a 94 1a 6e  ...l...n               387.1.24       
  57.2  ISOC   0c 0c 89 5b  81 4e eb 4d  ...[.N.M               388.1.0        
               eb 4e 1e 05  20 88 20 7d  .N.. . .               388.1.8        
               20 86 20 7f  21 83 21 7c   . .!.!.               388.1.16       
               21 85 21 7b  1f 87 1f 7c  !.!.....               388.1.24       
  57    ISOC                                                    389.1.0(5)     
  57.2  ISOC   0c 0d 83 7e  13 4e 76 18  .....Nv.               394.1.0        
               69 4e 7e 04  15 90 14 73  iN.....s               394.1.8        
               15 90 14 73  14 90 13 76  ...s...v               394.1.16       
               13 92 13 77  14 97 14 75  ...w...u               394.1.24       
  57.2  ISOC   0c 0d 85 38  ef 4e fe 77  ...8.N.w               395.1.0        
               46 4f 8e 05  10 8b 10 79  FO.....y               395.1.8        
               10 8a 10 7a  10 8b 10 7a  ...z...z               395.1.16       
               10 8b 10 79  10 8d 10 78  ...y...x               395.1.24       
  57.2  ISOC   0c 0d 85 38  ef 4e 26 7d  ...8.N&.               396.1.0        
               53 4f 9e 05  15 8d 15 73  SO.....s               396.1.8        
               14 91 14 75  15 94 16 76  ...u...v               396.1.16       
               16 90 17 74  17 8e 17 73  ...t...s               396.1.24       
  57    ISOC                                                    397.1.0(6)     
  57.2  ISOC   0c 0c 89 5b  81 4e 73 48  ...[.NsH               403.1.0        
               de 4e 0e 05  1b 93 1b 71  .N.....q               403.1.8        
               1a 95 1b 71  1b 93 1b 6e  ...q...n               403.1.16       
               1b 91 1a 6c  1a 94 1a 6e  ...l...n               403.1.24       
  57.2  ISOC   0c 0c 89 15  5d 4f ab a3  ....]O..               404.1.0        
               bb 4f 1e 06  14 91 15 75  .O.....u               404.1.8        
               15 8f 15 76  15 8f 15 76  ...v...v               404.1.16       
               14 8f 14 76  14 92 13 76  ...v...v               404.1.24       
  57.2  ISOC   0c 0c 89 15  5d 4f 7b a8  ....]O..               405.1.0        
               c8 4f 2e 06  15 8e 14 79  .O.....y               405.1.8        
               14 8f 14 7a  15 8e 14 79  ...z...y               405.1.16       
               14 8f 14 7a  14 8f 14 7a  ...z...z               405.1.24       
  57    ISOC                                                    406.1.0(5)     
  57.2  ISOC   0c 0d 85 38  ef 4e fe 77  ...8.N.w               411.1.0        
               46 4f 8e 05  10 8b 10 79  FO.....y               411.1.8        
               10 8a 10 7a  10 8b 10 7a  ...z...z               411.1.16       
               10 8b 10 79  10 8d 10 78  ...y...x               411.1.24       
  57.2  ISOC   0c 0d 88 f2  ca 4f 46 cd  .....OF.               412.1.0        
               23 50 9e 06  1e 91 1d 6b  #P.....k               412.1.8        
               1d 92 1d 6c  1d 93 1d 6c  ...l...l               412.1.16       
               1b 96 1c 6d  1d 97 1d 6c  ...m...l               412.1.24       
  57.2  ISOC   0c 0d 88 f2  ca 4f be d2  .....O..               413.1.0        
               30 50 ae 06  1d 9c 1e 6a  0P.....j               413.1.8        
               1e 9c 1d 6b  1d 9f 1d 6b  ...k...k               413.1.16       
               1d 9c 1c 6c  1d 9c 1c 6c  ...l...l               413.1.24       
  57    ISOC                                                    414.1.0(6)     
  57.2  ISOC   0c 0c 89 15  5d 4f ab a3  ....]O..               420.1.0        
               bb 4f 1e 06  14 91 15 75  .O.....u               420.1.8        
               15 8f 15 76  15 8f 15 76  ...v...v               420.1.16       
               14 8f 14 76  14 92 13 76  ...v...v               420.1.24       
  57.2  ISOC   0c 0c 87 cf  38 50 73 02  ....8Ps.               421.1.0        
               99 50 2e 07  18 8c 18 70  .P.....p               421.1.8        
               16 8d 17 72  15 8f 16 74  ...r...t               421.1.16       
               15 91 16 73  17 93 18 72  ...s...r               421.1.24       
  57.2  ISOC   0c 0c 87 cf  38 50 cb 07  ....8P..               422.1.0        
               a6 50 3e 07  17 85 17 8b  .P>.....               422.1.8        
               18 84 18 8d  1a 82 19 90  ........               422.1.16       
               1a 81 19 90  18 84 18 92  ........               422.1.24       
  57    ISOC                                                    423.1.0(5)     
  57.2  ISOC   0c 0d 88 f2  ca 4f 46 cd  .....OF.               428.1.0        
               23 50 9e 06  1e 91 1d 6b  #P.....k               428.1.8        
               1d 92 1d 6c  1d 93 1d 6c  ...l...l               428.1.16       
               1b 96 1c 6d  1d 97 1d 6c  ...m...l               428.1.24       
  57.2  ISOC   0c 0d 84 ac  a6 50 06 2a  .....P.*               429.1.0        
               01 51 ae 07  13 90 11 76  .Q.....v               429.1.8        
               11 91 12 77  12 8f 12 77  ...w...w               429.1.16       
               12 8f 12 77  12 8d 12 77  ...w...w               429.1.24       
  57.2  ISOC   0c 0d 84 ac  a6 50 d6 2e  .....P..               430.1.0        
               0e 51 be 07  19 90 18 70  .Q.....p               430.1.8        
               18 92 18 71  18 92 18 71  ...q...q               430.1.16       
               18 8e 18 71  18 90 18 71  ...q...q               430.1.24       
  57    ISOC                                                    431.1.0(5)     
  57.2  ISOC   0c 0c 89 15  5d 4f ab a3  ....]O..               436.1.0        
               bb 4f 1e 06  14 91 15 75  .O.....u               436.1.8        
               15 8f 15 76  15 8f 15 76  ...v...v               436.1.16       
               14 8f 14 76  14 92 13 76  ...v...v               436.1.24       
  57.2  ISOC   0c 0c 8c 89  14 51 4b 52  .....QKR               437.1.0        
               69 51 2e 00  17 97 17 71  iQ.....q               437.1.8        
               17 97 17 70  17 97 17 70  ...p...p               437.1.16       
               17 97 16 71  17 99 17 71  ...q...q               437.1.24       
  57.2  ISOC   0c 0c 8c 89  14 51 9b 57  .....Q.W               438.1.0        
               76 51 3e 00  25 a8 22 68  vQ>.%."h               438.1.8        
               23 a9 24 66  27 a5 27 63  #.$f'.'c               438.1.16       
               28 a4 26 64  26 a6 26 67  (.&d&.&g               438.1.24       
  57    ISOC                                                    439.1.0(6)     
  57.2  ISOC   0c 0d 84 ac  a6 50 06 2a  .....P.*               445.1.0        
               01 51 ae 07  13 90 11 76  .Q.....v               445.1.8        
               11 91 12 77  12 8f 12 77  ...w...w               445.1.16       
               12 8f 12 77  12 8d 12 77  ...w...w               445.1.24       
  57.2  ISOC   0c 0d 8b 66  82 51 49 83  ...f.QI.               446.1.0        
               de 51 be 00  13 8f 14 76  .Q.....v               446.1.8        
               14 8c 15 74  15 8d 15 75  ...t...u               446.1.16       
               13 8f 13 77  14 90 15 74  ...w...t               446.1.24       
  57.2  ISOC   0c 0d 8b 66  82 51 de 8c  ...f.Q..               447.1.0        
               eb 51 ce 00  15 8a 14 75  .Q.....u               447.1.8        
               15 8a 14 75  15 8b 17 74  ...u...t               447.1.16       
               17 89 16 74  16 8c 16 75  ...t...u               447.1.24       
  57    ISOC                                                    448.1.0(5)     
  57.2  ISOC   0c 0c 8c 89  14 51 4b 52  .....QKR               453.1.0        
               69 51 2e 00  17 97 17 71  iQ.....q               453.1.8        
               17 97 17 70  17 97 17 70  ...p...p               453.1.16       
               17 97 16 71  17 99 17 71  ...q...q               453.1.24       
  57.2  ISOC   0c 0c 9b 43  f0 51 6b b0  ...C.Qk.               454.1.0        
               46 52 3e 01  10 88 10 79  FR>....y               454.1.8        
               10 89 10 78  10 8b 10 77  ...x...w               454.1.16       
               10 8c 10 77  11 8b 11 76  ...w...v               454.1.24       
  57.2  ISOC   0c 0c 9b 43  f0 51 3b b5  ...C.Q;.               455.1.0        
               53 52 4e 01  15 91 14 75  SRN....u               455.1.8        
               16 91 14 76  16 92 14 74  ...v...t               455.1.16       
               15 95 15 73  16 96 16 75  ...s...u               455.1.24       
  57    ISOC                                                    456.1.0(6)     
  57.2  ISOC   0c 0d 8b 66  82 51 49 83  ...f.QI.               462.1.0        
               de 51 be 00  13 8f 14 76  .Q.....v               462.1.8        
               14 8c 15 74  15 8d 15 75  ...t...u               462.1.16       
               13 8f 13 77  14 90 15 74  ...w...t               462.1.24       
  57.2  ISOC   0c 0d 9a 20  5e 52 ce dc  ... ^R..               463.1.0        
               bb 52 ce 01  21 9f 1f 6a  .R..!..j               463.1.8        
               1f a0 1f 6b  20 a0 21 69  ...k .!i               463.1.16       
               22 9d 22 67  22 9c 21 68  "."g".!h               463.1.24       
  57.2  ISOC   0c 0d 9a 20  5e 52 16 e2  ... ^R..               464.1.0        
               c8 52 de 01  1b 9c 1c 6e  .R.....n               464.1.8        
               1c 99 1d 6d  1d 9a 1e 6b  ...m...k               464.1.16       
               1d 99 1d 6e  1d 9b 1e 6c  ...n...l               464.1.24       
  57    ISOC                                                    465.1.0(5)     
  57.2  ISOC   0c 0c 9b 43  f0 51 6b b0  ...C.Qk.               470.1.0        
               46 52 3e 01  10 88 10 79  FR>....y               470.1.8        
               10 89 10 78  10 8b 10 77  ...x...w               470.1.16       
               10 8c 10 77  11 8b 11 76  ...w...v               470.1.24       
  57.2  ISOC   0c 0c 9b fd  cb 52 e3 07  .....R..               471.1.0        
               24 53 4e 02  10 87 10 77  $SN....w               471.1.8        
               10 87 10 78  10 88 10 79  ...x...y               471.1.16       
               10 86 10 79  10 87 10 79  ...y...y               471.1.24       
  57.2  ISOC   0c 0c 9b fd  cb 52 73 0d  .....Rs.               472.1.0        
               31 53 5e 02  11 89 11 76  1S^....v               472.1.8        
               10 8b 11 76  11 8a 12 75  ...v...u               472.1.16       
               12 8a 12 73  11 8b 11 76  ...s...v               472.1.24       
  57    ISOC                                                    473.1.0(6)     
  57.2  ISOC   0c 0d 9a 20  5e 52 ce dc  ... ^R..               479.1.0        
               bb 52 ce 01  21 9f 1f 6a  .R..!..j               479.1.8        
               1f a0 1f 6b  20 a0 21 69  ...k .!i               479.1.16       
               22 9d 22 67  22 9c 21 68  "."g".!h               479.1.24       
  57.2  ISOC   0c 0d 97 da  39 53 96 3b  ....9S.;               480.1.0        
               99 53 de 02  16 91 16 71  .S.....q               480.1.8        
               16 8e 16 72  15 8f 15 73  ...r...s               480.1.16       
               15 90 15 73  14 91 15 74  ...s...t               480.1.24       
  57.2  ISOC   0c 0d 97 da  39 53 66 40  ....9Sf@               481.1.0        
               a6 53 ee 02  15 85 15 85  .S......               481.1.8        
               15 85 16 89  16 84 16 8a  ........               481.1.16       
               16 84 16 8a  16 85 17 88  ........               481.1.24       
  57    ISOC                                                    482.1.0(5)     
  57.2  ISOC   0c 0c 9b fd  cb 52 e3 07  .....R..               487.1.0        
               24 53 4e 02  10 87 10 77  $SN....w               487.1.8        
               10 87 10 78  10 88 10 79  ...x...y               487.1.16       
               10 86 10 79  10 87 10 79  ...y...y               487.1.24       
  57.2  ISOC   0c 0c a4 b7  a7 53 23 62  .....S#b               488.1.0        
               01 54 5e 03  14 95 14 75  .T^....u               488.1.8        
               14 94 14 75  15 93 15 73  ...u...s               488.1.16       
               16 96 15 72  16 96 16 71  ...r...q               488.1.24       
  57.2  ISOC   0c 0c a4 b7  a7 53 43 67  .....SCg               489.1.0        
               0e 54 6e 03  1b 99 1b 70  .Tn....p               489.1.8        
               1a 99 1a 6e  19 9a 1a 6f  ...n...o               489.1.16       
               1a 99 1b 6f  1a 9a 1a 6e  ...o...n               489.1.24       
  57    ISOC                                                    490.1.0(5)     
  57.2  ISOC   0c 0d 9a 20  5e 52 ce dc  ... ^R..               495.1.0        
               bb 52 ce 01  21 9f 1f 6a  .R..!..j               495.1.8        
               1f a0 1f 6b  20 a0 21 69  ...k .!i               495.1.16       
               22 9d 22 67  22 9c 21 68  "."g".!h               495.1.24       
  57.2  ISOC   0c 0d a9 94  15 54 16 8f  .....T..               496.1.0        
               69 54 de 03  10 87 10 7c  iT......               496.1.8        
               10 84 10 7c  10 84 10 7d  ........               496.1.16       
               10 85 10 7c  10 84 10 7c  ........               496.1.24       
  57.2  ISOC   0c 0d a9 94  15 54 06 92  .....T..               497.1.0        
               76 54 ee 03  1c 98 1a 6f  vT.....o               497.1.8        
               1d 96 20 6e  1f 93 1e 70  .. n...p               497.1.16       
               1d 92 1d 71  1c 94 1c 6f  ...q...o               497.1.24       
  57    ISOC                                                    498.1.0(6)     
  57.2  ISOC   0c 0c a4 b7  a7 53 23 62  .....S#b               504.1.0        
               01 54 5e 03  14 95 14 75  .T^....u               504.1.8        
               14 94 14 75  15 93 15 73  ...u...s               504.1.16       
               16 96 15 72  16 96 16 71  ...r...q               504.1.24       
  57.2  ISOC   0c 0c a5 71  83 54 ab c1  ...q.T..               505.1.0        
               de 54 6e 04  13 91 13 77  .Tn....w               505.1.8        
               13 91 13 76  13 90 13 76  ...v...v               505.1.16       
               14 8c 14 75  14 8b 13 75  ...u...u               505.1.24       
  57.2  ISOC   0c 0c a5 71  83 54 d3 c6  ...q.T..               506.1.0        
               eb 54 7e 04  18 88 18 72  .T.....r               506.1.8        
               18 8a 17 73  17 8b 16 75  ...s...u               506.1.16       
               16 90 16 76  15 90 16 77  ...v...w               506.1.24       
  57    ISOC                                                    507.1.0(5)     
  57.2  ISOC   0c 0d a9 94  15 54 16 8f  .....T..               512.1.0        
               69 54 de 03  10 87 10 7c  iT......               512.1.8        
               10 84 10 7c  10 84 10 7d  ........               512.1.16       
               10 85 10 7c  10 84 10 7c  ........               512.1.24       
  57.2  ISOC   0c 0d a6 4e  f1 54 76 e8  ...N.Tv.               513.1.0        
               46 55 ee 04  12 8f 11 74  FU.....t               513.1.8        
               12 91 12 73  13 90 13 76  ...s...v               513.1.16       
               13 90 11 76  11 91 11 77  ...v...w               513.1.24       
  57.2  ISOC   0c 0d a6 4e  f1 54 46 ed  ...N.TF.               514.1.0        
               53 55 fe 04  19 96 19 70  SU.....p               514.1.8        
               18 97 19 70  18 95 19 71  ...p...q               514.1.16       
               19 94 1b 70  19 95 1a 70  ...p...p               514.1.24       
  57    ISOC                                                    515.1.0(6)     
  57.2  ISOC   0c 0c a5 71  83 54 ab c1  ...q.T..               521.1.0        
               de 54 6e 04  13 91 13 77  .Tn....w               521.1.8        
               13 91 13 76  13 90 13 76  ...v...v               521.1.16       
               14 8c 14 75  14 8b 13 75  ...u...u               521.1.24       
  57.2  ISOC   0c 0c ad 2b  5f 55 db 16  ...+_U..               522.1.0        
               bc 55 7e 05  22 a1 23 68  .U..".#h               522.1.8        
               23 9f 25 66  25 9e 25 65  #.%f%.%e               522.1.16       
               24 9d 24 63  24 a0 25 64  $.$c$.%d               522.1.24       
  57.2  ISOC   0c 0c ad 2b  5f 55 53 1c  ...+_US.               523.1.0        
               c9 55 8e 05  1b 9b 1c 6d  .U.....m               523.1.8        
               1b 9b 1a 6d  1b 9d 1b 6c  ...m...l               523.1.16       
               1b 9b 1d 6b  1e 99 1e 69  ...k...i               523.1.24       
  57    ISOC                                                    524.1.0(5)     
  57.2  ISOC   0c 0d a6 4e  f1 54 76 e8  ...N.Tv.               529.1.0        
               46 55 ee 04  12 8f 11 74  FU.....t               529.1.8        
               12 91 12 73  13 90 13 76  ...s...v               529.1.16       
               13 90 11 76  11 91 11 77  ...v...w               529.1.24       
  57.2  ISOC   0c 0d ba 08  cd 55 b6 46  .....U.F               530.1.0        
               24 56 fe 05  10 89 10 78  $V.....x               530.1.8        
               10 89 10 79  10 8a 10 79  ...y...y               530.1.16       
               10 8a 10 78  10 8a 10 76  ...x...v               530.1.24       
  57.2  ISOC   0c 0d ba 08  cd 55 0e 4c  .....U.L               531.1.0        
               31 56 0e 06  14 91 14 75  1V.....u               531.1.8        
               14 92 16 75  16 90 16 75  ...u...u               531.1.16       
               15 8f 16 75  14 8f 16 75  ...u...u               531.1.24       
  57    ISOC                                                    532.1.0(6)     
  57.2  ISOC   0c 0c ad 2b  5f 55 db 16  ...+_U..               538.1.0        
               bc 55 7e 05  22 a1 23 68  .U..".#h               538.1.8        
               23 9f 25 66  25 9e 25 65  #.%f%.%e               538.1.16       
               24 9d 24 63  24 a0 25 64  $.$c$.%d               538.1.24       
  57.2  ISOC   0c 0c c7 e5  3a 56 b3 73  ....:V.s               539.1.0        
               99 56 8e 06  14 91 15 72  .V.....r               539.1.8        
               14 90 15 73  14 8f 15 74  ...s...t               539.1.16       
               15 8e 17 73  16 8e 17 72  ...s...r               539.1.24       
  57.2  ISOC   0c 0c c7 e5  3a 56 7b 78  ....:V.x               540.1.0        
               a6 56 9e 06  14 8c 13 79  .V.....y               540.1.8        
               12 8d 12 7a  12 91 13 79  ...z...y               540.1.16       
               15 8f 13 77  15 8f 15 78  ...w...x               540.1.24       
  57    ISOC                                                    541.1.0(5)     
  57.2  ISOC   0c 0d ba 08  cd 55 b6 46  .....U.F               546.1.0        
               24 56 fe 05  10 89 10 78  $V.....x               546.1.8        
               10 89 10 79  10 8a 10 79  ...y...y               546.1.16       
               10 8a 10 78  10 8a 10 76  ...x...v               546.1.24       
  57.2  ISOC   0c 0d b5 c2  a8 56 de 9b  .....V..               547.1.0        
               01 57 0e 07  1a 98 1c 6d  .W.....m               547.1.8        
               1a 96 1c 6d  1c 95 1c 6c  ...m...l               547.1.16       
               1a 97 1b 6d  1b 9b 1b 6c  ...m...l               547.1.24       
  57.2  ISOC   0c 0d b5 c2  a8 56 2e a1  .....V..               548.1.0        
               0e 57 1e 07  21 a2 21 6a  .W..!.!j               548.1.8        
               21 a2 22 6a  24 a0 24 69  !."j$.$i               548.1.16       
               24 9f 23 68  23 9e 22 68  $.#h#."h               548.1.24       
  57    ISOC                                                    549.1.0(6)     
  57.2  ISOC   0c 0c c7 e5  3a 56 b3 73  ....:V.s               555.1.0        
               99 56 8e 06  14 91 15 72  .V.....r               555.1.8        
               14 90 15 73  14 8f 15 74  ...s...t               555.1.16       
               15 8e 17 73  16 8e 17 72  ...s...r               555.1.24       
  57.2  ISOC   0c 0c c6 9f  16 57 da cc  .....W..               556.1.0        
               76 57 9e 07  14 92 14 73  vW.....s               556.1.8        
               13 92 13 75  13 90 15 75  ...u...u               556.1.16       
               15 8d 15 75  14 8d 14 75  ...u...u               556.1.24       
  57.2  ISOC   0c 0c c6 9f  16 57 73 d6  .....Ws.               557.1.0        
               83 57 ae 07  17 84 16 8b  .W......               557.1.8        
               17 87 17 8d  18 88 18 8d  ........               557.1.16       
               1a 85 1a 8f  1a 86 1a 90  ........               557.1.24       
  57    ISOC                                                    558.1.0(5)     
  57.2  ISOC   0c 0d b5 c2  a8 56 de 9b  .....V..               563.1.0        
               01 57 0e 07  1a 98 1c 6d  .W.....m               563.1.8        
               1a 96 1c 6d  1c 95 1c 6c  ...m...l               563.1.16       
               1a 97 1b 6d  1b 9b 1b 6c  ...m...l               563.1.24       
  57.2  ISOC   0c 0d cf 7c  84 57 06 fa  .....W..               564.1.0        
               de 57 1e 00  13 8c 13 75  .W.....u               564.1.8        
               12 8e 13 76  12 8e 13 76  ...v...v               564.1.16       
               12 8e 12 77  11 90 12 78  ...w...x               564.1.24       
  57.2  ISOC   0c 0d cf 7c  84 57 d6 fe  .....W..               565.1.0        
               eb 57 2e 00  17 8d 17 73  .W.....s               565.1.8        
               16 8f 17 74  17 8e 17 73  ...t...s               565.1.16       
               17 8e 16 74  16 8d 15 74  ...t...t               565.1.24       
  57    ISOC                                                    566.1.0(5)     
  57.2  ISOC   0c 0c c7 e5  3a 56 b3 73  ....:V.s               571.1.0        
               99 56 8e 06  14 91 15 72  .V.....r               571.1.8        
               14 90 15 73  14 8f 15 74  ...s...t               571.1.16       
               15 8e 17 73  16 8e 17 72  ...s...r               571.1.24       
  57.2  ISOC   0c 0c dc 59  f2 57 13 21  ...Y.W.!               572.1.0        
               47 58 9e 00  17 97 18 6f  GX.....o               572.1.8        
               17 97 18 71  18 96 18 72  ...q...r               572.1.16       
               19 95 19 70  19 94 19 6f  ...p...o               572.1.24       
  57.2  ISOC   0c 0c dc 59  f2 57 5b 26  ...Y.W[&               573.1.0        
               54 58 ae 00  1e a6 1e 67  TX.....g               573.1.8        
               1f a7 1d 67  1d a9 1d 69  ...g...i               573.1.16       
               1d a7 1e 69  1e a4 1d 6a  ...i...j               573.1.24       
  57    ISOC                                                    574.1.0(6)     
  57.2  ISOC   0c 0d cf 7c  84 57 06 fa  .....W..               580.1.0        
               de 57 1e 00  13 8c 13 75  .W.....u               580.1.8        
               12 8e 13 76  12 8e 13 76  ...v...v               580.1.16       
               12 8e 12 77  11 90 12 78  ...w...x               580.1.24       
  57.2  ISOC   0c 0d d2 36  60 58 6e 51  ...6`XnQ               581.1.0        
               bc 58 2e 01  10 8b 10 77  .X.....w               581.1.8        
               10 8c 10 79  10 8b 10 7a  ...y...z               581.1.16       
               11 8a 12 79  11 88 12 79  ...y...y               581.1.24       
  57.2  ISOC   0c 0d d2 36  60 58 06 57  ...6`X.W               582.1.0        
               c9 58 3e 01  12 8b 11 78  .X>....x               582.1.8        
               11 8d 11 7a  12 8a 11 79  ...z...y               582.1.16       
               12 8c 12 79  12 8d 12 79  ...y...y               582.1.24       
  57    ISOC                                                    583.1.0(5)     
  57.2  ISOC   0c 0c dc 59  f2 57 13 21  ...Y.W.!               588.1.0        
               47 58 9e 00  17 97 18 6f  GX.....o               588.1.8        
               17 97 18 71  18 96 18 72  ...q...r               588.1.16       
               19 95 19 70  19 94 19 6f  ...p...o               588.1.24       
  57.2  ISOC   0c 0c dd 13  ce 58 6b 80  .....Xk.               589.1.0        
               24 59 ae 01  10 8b 10 77  $Y.....w               589.1.8        
               10 8c 10 76  10 8a 10 77  ...v...w               589.1.16       
               10 8b 10 78  10 8f 10 78  ...x...x               589.1.24       
  57.2  ISOC   0c 0c dd 13  ce 58 3b 85  .....X;.               590.1.0        
               31 59 be 01  16 8e 16 75  1Y.....u               590.1.8        
               16 8e 16 75  16 92 17 73  ...u...s               590.1.16       
               17 94 17 72  16 92 17 72  ...r...r               590.1.24       
  57    ISOC                                                    591.1.0(6)     
  57.2  ISOC   0c 0d d2 36  60 58 6e 51  ...6`XnQ               597.1.0        
               bc 58 2e 01  10 8b 10 77  .X.....w               597.1.8        
               10 8c 10 79  10 8b 10 7a  ...y...z               597.1.16       
               11 8a 12 79  11 88 12 79  ...y...y               597.1.24       
  57.2  ISOC   0c 0d df f0  3b 59 b6 ab  ....;Y..               598.1.0        
               99 59 3e 02  1a 9c 1b 70  .Y>....p               598.1.8        
               1b 99 1c 6f  1c 97 1c 6e  ...o...n               598.1.16       
               1c 97 1d 6d  1d 96 1c 6e  ...m...n               598.1.24       
  57.2  ISOC   0c 0d df f0  3b 59 ce b0  ....;Y..               599.1.0        
               a6 59 4e 02  1a 94 1a 72  .YN....r               599.1.8        
               1a 94 1a 72  1a 96 1a 72  ...r...r               599.1.16       
               19 97 1a 6f  19 95 1a 71  ...o...q               599.1.24       
  57    ISOC                                                    600.1.0(5)     
  57.2  ISOC   0c 0c dd 13  ce 58 6b 80  .....Xk.               605.1.0        
               24 59 ae 01  10 8b 10 77  $Y.....w               605.1.8        
               10 8c 10 76  10 8a 10 77  ...v...w               605.1.16       
               10 8b 10 78  10 8f 10 78  ...x...x               605.1.24       
  57.2  ISOC   0c 0c ed cd  a9 59 23 d6  .....Y#.               606.1.0        
               01 5a be 02  17 96 17 72  .Z.....r               606.1.8        
               17 96 16 71  18 93 17 71  ...q...q               606.1.16       
               17 95 18 71  18 94 18 6f  ...q...o               606.1.24       
  57.2  ISOC   0c 0c ed cd  a9 59 9b db  .....Y..               607.1.0        
               0e 5a ce 02  14 8e 14 75  .Z.....u               607.1.8        
               14 90 14 75  14 92 14 76  ...u...v               607.1.16       
               14 92 16 75  14 91 14 77  ...u...w               607.1.24       
  57    ISOC                                                    608.1.0(6)     
  57.2  ISOC   0c 0d df f0  3b 59 b6 ab  ....;Y..               614.1.0        
               99 59 3e 02  1a 9c 1b 70  .Y>....p               614.1.8        
               1b 99 1c 6f  1c 97 1c 6e  ...o...n               614.1.16       
               1c 97 1d 6d  1d 96 1c 6e  ...m...n               614.1.24       
  57.2  ISOC   0c 0d e6 aa  17 5a 3e 0b  .....Z>.               615.1.0        
               77 5a 4e 03  15 94 15 72  wZN....r               615.1.8        
               15 94 15 73  15 94 15 75  ...s...u               615.1.16       
               15 94 15 75  16 92 16 75  ...u...u               615.1.24       
  57.2  ISOC   0c 0d e6 aa  17 5a 66 10  .....Zf.               616.1.0        
               84 5a 5e 03  16 87 16 86  .Z^.....               616.1.8        
               16 83 16 86  16 87 16 86  ........               616.1.16       
               16 87 15 86  15 88 16 88  ........               616.1.24       
  57    ISOC                                                    617.1.0(5)     
  57.2  ISOC   0c 0c ed cd  a9 59 23 d6  .....Y#.               622.1.0        
               01 5a be 02  17 96 17 72  .Z.....r               622.1.8        
               17 96 16 71  18 93 17 71  ...q...q               622.1.16       
               17 95 18 71  18 94 18 6f  ...q...o               622.1.24       
  57.2  ISOC   0c 0c f4 87  85 5a 1b 32  .....Z.2               623.1.0        
               df 5a ce 03  15 8e 14 74  .Z.....t               623.1.8        
               15 90 15 73  15 90 15 73  ...s...s               623.1.16       
               15 92 14 73  15 94 15 75  ...s...u               623.1.24       
  57.2  ISOC   0c 0c f4 87  85 5a eb 36  .....Z.6               624.1.0        
               ec 5a de 03  18 95 19 71  .Z.....q               624.1.8        
               19 95 19 72  19 96 1a 73  ...r...s               624.1.16       
               1a 92 1a 73  1a 90 1a 73  ...s...s               624.1.24       
  57    ISOC                                                    625.1.0(5)     
  57.2  ISOC   0c 0d df f0  3b 59 b6 ab  ....;Y..               630.1.0        
               99 59 3e 02  1a 9c 1b 70  .Y>....p               630.1.8        
               1b 99 1c 6f  1c 97 1c 6e  ...o...n               630.1.16       
               1c 97 1d 6d  1d 96 1c 6e  ...m...n               630.1.24       
  57.2  ISOC   0c 0d f4 64  f3 5a 26 5d  ...d.Z&]               631.1.0        
               47 5b 4e 04  14 94 14 73  G[N....s               631.1.8        
               14 91 14 72  14 92 14 71  ...r...q               631.1.16       
               14 91 14 70  15 91 15 73  ...p...s               631.1.24       
  57.2  ISOC   0c 0d f4 64  f3 5a 66 60  ...d.Zf`               632.1.0        
               54 5b 5e 04  26 a9 26 68  T[^.&.&h               632.1.8        
               27 a5 27 66  27 a8 27 66  '.'f'.'f               632.1.16       
               27 a9 26 65  26 ab 27 66  '.&e&.'f               632.1.24       
  57    ISOC                                                    633.1.0(6)     
  57.2  ISOC   0c 0c f4 87  85 5a 1b 32  .....Z.2               639.1.0        
               df 5a ce 03  15 8e 14 74  .Z.....t               639.1.8        
               15 90 15 73  15 90 15 73  ...s...s               639.1.16       
               15 92 14 73  15 94 15 75  ...s...u               639.1.24       
  57.2  ISOC   0c 0c 14 42  61 5b 53 90  ...Ba[S.               640.1.0        
               bc 5b de 04  14 94 13 76  .[.....v               640.1.8        
               12 93 12 75  12 94 13 76  ...u...v               640.1.16       
               12 92 12 73  12 90 13 72  ...s...r               640.1.24       
  57.2  ISOC   0c 0c 14 42  61 5b a3 95  ...Ba[..               641.1.0        
               c9 5b ee 04  16 8f 17 74  .[.....t               641.1.8        
               16 8e 17 72  16 90 16 75  ...r...u               641.1.16       
               15 92 16 76  16 90 16 76  ...v...v               641.1.24       
  57    ISOC                                                    642.1.0(5)     
  57.2  ISOC   0c 0d f4 64  f3 5a 26 5d  ...d.Z&]               647.1.0        
               47 5b 4e 04  14 94 14 73  G[N....s               647.1.8        
               14 91 14 72  14 92 14 71  ...r...q               647.1.16       
               14 91 14 70  15 91 15 73  ...p...s               647.1.24       
  57.2  ISOC   0c 0d 0a 1f  cf 5b 76 b8  .....[v.               648.1.0        
               24 5c 5e 05  10 90 10 79  $\^....y               648.1.8        
               10 91 10 78  10 91 10 77  ...x...w               648.1.16       
               10 8f 10 79  12 8f 10 79  ...y...y               648.1.24       
  57.2  ISOC   0c 0d 0a 1f  cf 5b 46 bd  .....[F.               649.1.0        
               31 5c 6e 05  15 97 15 76  1\n....v               649.1.8        
               15 96 15 76  15 93 16 76  ...v...v               649.1.16       
               16 90 16 76  16 91 17 75  ...v...u               649.1.24       
  57    ISOC                                                    650.1.0(6)     
  57.2  ISOC   0c 0c 14 42  61 5b 53 90  ...Ba[S.               656.1.0        
               bc 5b de 04  14 94 13 76  .[.....v               656.1.8        
               12 93 12 75  12 94 13 76  ...u...v               656.1.16       
               12 92 12 73  12 90 13 72  ...s...r               656.1.24       
  57.2  ISOC   0c 0c 14 fc  3c 5c 73 e5  ....<\s.               657.1.0        
               99 5c ee 05  22 a3 23 66  .\..".#f               657.1.8        
               23 a0 27 64  23 9f 22 66  #.'d#."f               657.1.16       
               21 a4 1f 69  1f a7 1f 6a  !..i...j               657.1.24       
  57.2  ISOC   0c 0c 14 fc  3c 5c bb ea  ....<\..               658.1.0        
               a6 5c fe 05  1a 9e 1a 6d  .\.....m               658.1.8        
               1c a0 1c 6d  1b a1 1b 6d  ...m...m               658.1.16       
               1b a2 1b 6d  1d a1 1b 6c  ...m...l               658.1.24       
  57    ISOC                                                    659.1.0(5)     
  57.2  ISOC   0c 0d 0a 1f  cf 5b 76 b8  .....[v.               664.1.0        
               24 5c 5e 05  10 90 10 79  $\^....y               664.1.8        
               10 91 10 78  10 91 10 77  ...x...w               664.1.16       
               10 8f 10 79  12 8f 10 79  ...y...y               664.1.24       
  57.2  ISOC   0c 0d 0f d9  aa 5c de 10  .....\..               665.1.0        
               02 5d 6e 06  10 8b 10 7a  .]n....z               665.1.8        
               10 8a 10 78  10 8b 10 77  ...x...w               665.1.16       
               10 8c 10 78  10 8d 10 78  ...x...x               665.1.24       
  57.2  ISOC   0c 0d 0f d9  aa 5c 6c 16  .....\l.               666.1.0        
               0f 5d 7e 06  14 92 15 74  .].....t               666.1.8        
               16 90 16 71  15 8f 15 73  ...q...s               666.1.16       
               14 90 15 75  14 91 16 75  ...u...u               666.1.24       
  57    ISOC                                                    667.1.0(6)     
  57.2  ISOC   0c 0c 14 fc  3c 5c 73 e5  ....<\s.               673.1.0        
               99 5c ee 05  22 a3 23 66  .\..".#f               673.1.8        
               23 a0 27 64  23 9f 22 66  #.'d#."f               673.1.16       
               21 a4 1f 69  1f a7 1f 6a  !..i...j               673.1.24       
  57.2  ISOC   0c 0c 1b b6  18 5d ab 43  .....].C               674.1.0        
               77 5d fe 06  15 92 15 75  w].....u               674.1.8        
               15 91 15 74  14 94 15 75  ...t...u               674.1.16       
               14 95 14 75  14 95 15 73  ...u...s               674.1.24       
  57.2  ISOC   0c 0c 1b b6  18 5d 7b 48  .....].H               675.1.0        
               84 5d 0e 07  11 8f 11 7d  .]......               675.1.8        
               12 90 12 7c  14 8f 15 79  .......y               675.1.16       
               16 8c 16 76  15 8c 14 79  ...v...y               675.1.24       
  57    ISOC                                                    676.1.0(5)     
  57.2  ISOC   0c 0d 0f d9  aa 5c de 10  .....\..               681.1.0        
               02 5d 6e 06  10 8b 10 7a  .]n....z               681.1.8        
               10 8a 10 78  10 8b 10 77  ...x...w               681.1.16       
               10 8c 10 78  10 8d 10 78  ...x...x               681.1.24       
  57.2  ISOC   0c 0d 1f 93  86 5d 9e 6a  .....].j               682.1.0        
               df 5d 7e 07  1d a2 1d 6c  .].....l               682.1.8        
               1b a4 1d 6c  1d a3 1e 6b  ...l...k               682.1.16       
               1d a2 1d 6c  1c a0 1d 6d  ...l...m               682.1.24       
  57.2  ISOC   0c 0d 1f 93  86 5d f6 6f  .....].o               683.1.0        
               ec 5d 8e 07  1e 9c 1d 6c  .].....l               683.1.8        
               1e 9c 1d 6c  1d 9e 1d 6c  ...l...l               683.1.16       
               1d 9f 1d 6c  1d a1 1b 6c  ...l...l               683.1.24       
  57    ISOC                                                    684.1.0(6)     
  57.2  ISOC   0c 0c 1b b6  18 5d ab 43  .....].C               690.1.0        
               77 5d fe 06  15 92 15 75  w].....u               690.1.8        
               15 91 15 74  14 94 15 75  ...t...u               690.1.16       
               14 95 14 75  14 95 15 73  ...u...s               690.1.24       
  57.2  ISOC   0c 0c 24 70  f4 5d e3 9a  ..$p.]..               691.1.0        
               54 5e 0e 00  10 8b 10 78  T^.....x               691.1.8        
               10 8b 10 77  10 8c 10 77  ...w...w               691.1.16       
               10 8d 10 77  10 8d 11 76  ...w...v               691.1.24       
  57.2  ISOC   0c 0c 24 70  f4 5d 73 a0  ..$p.]s.               692.1.0        
               61 5e 1e 00  13 85 12 79  a^.....y               692.1.8        
               11 86 10 78  10 89 10 79  ...x...y               692.1.16       
               10 8c 10 78  10 8c 10 77  ...x...w               692.1.24       
  57    ISOC                                                    693.1.0(5)     
  57.2  ISOC   0c 0d 1f 93  86 5d 9e 6a  .....].j               698.1.0        
               df 5d 7e 07  1d a2 1d 6c  .].....l               698.1.8        
               1b a4 1d 6c  1d a3 1e 6b  ...l...k               698.1.16       
               1d a2 1d 6c  1c a0 1d 6d  ...l...m               698.1.24       
  57.2  ISOC   0c 0d 1f 4d  62 5e 0e ca  ...Mb^..               699.1.0        
               bc 5e 8e 00  12 94 12 75  .^.....u               699.1.8        
               12 94 11 75  12 95 12 76  ...u...v               699.1.16       
               11 95 12 75  10 94 10 79  ...u...y               699.1.24       
  57.2  ISOC   0c 0d 1f 4d  62 5e d6 ce  ...Mb^..               700.1.0        
               c9 5e 9e 00  15 95 15 72  .^.....r               700.1.8        
               17 92 17 6f  17 90 15 71  ...o...q               700.1.16       
               15 91 16 74  15 93 15 76  ...t...v               700.1.24       
  57    ISOC                                                    701.1.0(5)     
  57.2  ISOC   0c 0c 1b b6  18 5d ab 43  .....].C               706.1.0        
               77 5d fe 06  15 92 15 75  w].....u               706.1.8        
               15 91 15 74  14 94 15 75  ...t...u               706.1.16       
               14 95 14 75  14 95 15 73  ...u...s               706.1.24       
  57.2  ISOC   0c 0c 26 2a  d0 5e 8b f0  ..&*.^..               707.1.0        
               24 5f 0e 01  13 96 11 76  $_.....v               707.1.8        
               11 97 12 78  11 95 12 76  ...x...v               707.1.16       
               12 95 13 72  12 95 12 73  ...r...s               707.1.24       
  57.2  ISOC   0c 0c 26 2a  d0 5e 5b f5  ..&*.^[.               708.1.0        
               31 5f 1e 01  17 98 17 73  1_.....s               708.1.8        
               17 96 17 73  18 96 17 73  ...s...s               708.1.16       
               17 98 17 73  19 97 18 73  ...s...s               708.1.24       
  57    ISOC                                                    709.1.0(6)     
  57.2  ISOC   0c 0d 1f 4d  62 5e 0e ca  ...Mb^..               715.1.0        
               bc 5e 8e 00  12 94 12 75  .^.....u               715.1.8        
               12 94 11 75  12 95 12 76  ...u...v               715.1.16       
               11 95 12 75  10 94 10 79  ...u...y               715.1.24       
  57.2  ISOC   0c 0d 0f 07  3e 5f ae 1f  ....>_..               716.1.0        
               9a 5f 9e 01  1e 9e 1d 6d  ._.....m               716.1.8        
               1d a0 1d 6d  1d 9f 1d 6c  ...m...l               716.1.16       
               1e 9e 1e 6c  20 9d 20 6b  ...l . k               716.1.24       
  57.2  ISOC   0c 0d 0f 07  3e 5f 26 25  ....>_&%               717.1.0        
               a7 5f ae 01  1a 99 1b 6d  ._.....m               717.1.8        
               1b 98 1b 6c  1a 9a 1b 6f  ...l...o               717.1.16       
               1a 99 1c 6e  1a 99 1c 6e  ...n...n               717.1.24       
  57    ISOC                                                    718.1.0(5)     
  57.2  ISOC   0c 0c 26 2a  d0 5e 8b f0  ..&*.^..               723.1.0        
               24 5f 0e 01  13 96 11 76  $_.....v               723.1.8        
               11 97 12 78  11 95 12 76  ...x...v               723.1.16       
               12 95 13 72  12 95 12 73  ...r...s               723.1.24       
  57.2  ISOC   0c 0c 1d e4  ab 5f 6b 4f  ....._kO               724.1.0        
               02 60 1e 02  10 8d 10 77  .`.....w               724.1.8        
               10 90 11 78  11 91 11 79  ...x...y               724.1.16       
               11 91 11 79  10 91 11 78  ...y...x               724.1.24       
  57.2  ISOC   0c 0c 1d e4  ab 5f c3 54  ....._.T               725.1.0        
               0f 60 2e 02  16 95 15 74  .`.....t               725.1.8        
               15 94 15 75  17 93 17 73  ...u...s               725.1.16       
               17 91 17 6f  17 90 18 70  ...o...p               725.1.24       
  57    ISOC                                                    726.1.0(6)     
  57.2  ISOC   0c 0d 0f 07  3e 5f ae 1f  ....>_..               732.1.0        
               9a 5f 9e 01  1e 9e 1d 6d  ._.....m               732.1.8        
               1d a0 1d 6d  1d 9f 1d 6c  ...m...l               732.1.16       
               1e 9e 1e 6c  20 9d 20 6b  ...l . k               732.1.24       
  57.2  ISOC   0c 0d 22 c1  19 60 b6 7b  .."..`..               733.1.0        
               77 60 ae 02  14 92 13 76  w`.....v               733.1.8        
               14 93 14 75  14 94 14 75  ...u...u               733.1.16       
               14 95 14 75  13 95 14 75  ...u...u               733.1.24       
  57.2  ISOC   0c 0d 22 c1  19 60 86 80  .."..`..               734.1.0        
               84 60 be 02  14 92 15 75  .`.....u               734.1.8        
               14 95 14 76  13 96 14 75  ...v...u               734.1.16       
               13 95 15 76  14 93 16 75  ...v...u               734.1.24       
  57    ISOC                                                    735.1.0(5)     
  57.2  ISOC   0c 0c 1d e4  ab 5f 6b 4f  ....._kO               740.1.0        
               02 60 1e 02  10 8d 10 77  .`.....w               740.1.8        
               10 90 11 78  11 91 11 79  ...x...y               740.1.16       
               11 91 11 79  10 91 11 78  ...y...x               740.1.24       
  57.2  ISOC   0c 0c 16 9e  87 60 8b a4  .....`..               741.1.0        
               df 60 2e 03  1c a0 1c 6e  .`.....n               741.1.8        
               1c a0 1c 6e  1d 9f 1f 6c  ...n...l               741.1.16       
               1e 9c 1d 6c  1d 9e 1d 6c  ...l...l               741.1.24       
  57.2  ISOC   0c 0c 16 9e  87 60 f3 a9  .....`..               742.1.0        
               ec 60 3e 03  1b a4 1c 6d  .`>....m               742.1.8        
               1c a0 1d 6d  1c 9f 1d 6d  ...m...m               742.1.16       
               1c 9f 1d 6d  1c 9f 1c 6e  ...m...n               742.1.24       
  57    ISOC                                                    743.1.0(6)     
  57.2  ISOC   0c 0d 22 c1  19 60 b6 7b  .."..`..               749.1.0        
               77 60 ae 02  14 92 13 76  w`.....v               749.1.8        
               14 93 14 75  14 94 14 75  ...u...u               749.1.16       
               14 95 14 75  13 95 14 75  ...u...u               749.1.24       
  57.2  ISOC   0c 0d 0f 7b  f5 60 e6 d9  .....`..               750.1.0        
               54 61 be 03  14 97 14 74  Ta.....t               750.1.8        
               14 97 14 74  15 94 14 73  ...t...s               750.1.16       
               15 94 14 73  15 93 13 76  ...s...v               750.1.24       
  57.2  ISOC   0c 0d 0f 7b  f5 60 26 df  .....`&.               751.1.0        
               61 61 ce 03  16 88 16 83  aa......               751.1.8        
               16 8a 16 83  16 88 16 83  ........               751.1.16       
               16 8a 16 84  15 8a 16 86  ........               751.1.24       
  57    ISOC                                                    752.1.0(5)     
  57.2  ISOC   0c 0c 16 9e  87 60 8b a4  .....`..               757.1.0        
               df 60 2e 03  1c a0 1c 6e  .`.....n               757.1.8        
               1c a0 1c 6e  1d 9f 1f 6c  ...n...l               757.1.16       
               1e 9c 1d 6c  1d 9e 1d 6c  ...l...l               757.1.24       
  57.2  ISOC   0c 0c 17 58  63 61 23 02  ...Xca#.               758.1.0        
               bd 61 3e 04  10 90 10 76  .a>....v               758.1.8        
               10 90 10 76  10 90 10 76  ...v...v               758.1.16       
               10 8e 10 78  10 8c 10 78  ...x...x               758.1.24       
  57.2  ISOC   0c 0c 17 58  63 61 eb 06  ...Xca..               759.1.0        
               ca 61 4e 04  13 92 14 76  .aN....v               759.1.8        
               14 91 16 75  15 8f 16 76  ...u...v               759.1.16       
               15 91 15 75  16 95 17 74  ...u...t               759.1.24       
  57    ISOC                                                    760.1.0(5)     
  57.2  ISOC   0c 0d 22 c1  19 60 b6 7b  .."..`..               765.1.0        
               77 60 ae 02  14 92 13 76  w`.....v               765.1.8        
               14 93 14 75  14 94 14 75  ...u...u               765.1.16       
               14 95 14 75  13 95 14 75  ...u...u               765.1.24       
  57.2  ISOC   0c 0d 0a 35  d1 61 26 2b  ...5.a&+               766.1.0        
               25 62 be 04  17 99 18 71  %b.....q               766.1.8        
               18 9a 18 72  18 9a 18 72  ...r...r               766.1.16       
               17 97 17 71  16 96 15 75  ...q...u               766.1.24       
  57.2  ISOC   0c 0d 0a 35  d1 61 06 2f  ...5.a./               767.1.0        
               32 62 ce 04  20 a9 21 67  2b.. .!g               767.1.8        
               21 aa 23 66  22 aa 23 67  !.#f".#g               767.1.16       
               23 ac 23 66  21 b0 21 67  #.#f!.!g               767.1.24       
  57    ISOC                                                    768.1.0(6)     
  57.2  ISOC   0c 0c 17 58  63 61 23 02  ...Xca#.               774.1.0        
               bd 61 3e 04  10 90 10 76  .a>....v               774.1.8        
               10 90 10 76  10 90 10 76  ...v...v               774.1.16       
               10 8e 10 78  10 8c 10 78  ...x...x               774.1.24       
  57.2  ISOC   0c 0c 24 12  3f 62 6b 5a  ..$.?bkZ               775.1.0        
               9a 62 4e 05  11 90 11 75  .bN....u               775.1.8        
               11 91 11 75  11 92 12 76  ...u...v               775.1.16       
               12 8f 11 78  11 8d 11 78  ...x...x               775.1.24       
  57.2  ISOC   0c 0c 24 12  3f 62 e8 5f  ..$.?b._               776.1.0        
               a7 62 5e 05  13 8e 14 75  .b^....u               776.1.8        
               14 8e 14 74  14 8e 14 74  ...t...t               776.1.16       
               14 92 15 75  14 94 16 75  ...u...u               776.1.24       
  57    ISOC                                                    777.1.0(5)     
  57.2  ISOC   0c 0d 0a 35  d1 61 26 2b  ...5.a&+               782.1.0        
               25 62 be 04  17 99 18 71  %b.....q               782.1.8        
               18 9a 18 72  18 9a 18 72  ...r...r               782.1.16       
               17 97 17 71  16 96 15 75  ...q...u               782.1.24       
  57.2  ISOC   0c 0d 15 ef  ac 62 76 88  .....bv.               783.1.0        
               02 63 ce 05  10 8f 10 7b  .c......               783.1.8        
               10 8d 10 79  10 90 10 77  ...y...w               783.1.16       
               10 92 10 76  10 94 10 77  ...v...w               783.1.24       
  57.2  ISOC   0c 0d 15 ef  ac 62 46 8d  .....bF.               784.1.0        
               0f 63 de 05  16 91 16 75  .c.....u               784.1.8        
               16 90 15 76  15 92 15 77  ...v...w               784.1.16       
               15 94 16 75  16 96 17 73  ...u...s               784.1.24       
  57    ISOC                                                    785.1.0(6)     
  57.2  ISOC   0c 0c 24 12  3f 62 6b 5a  ..$.?bkZ               791.1.0        
               9a 62 4e 05  11 90 11 75  .bN....u               791.1.8        
               11 91 11 75  11 92 12 76  ...u...v               791.1.16       
               12 8f 11 78  11 8d 11 78  ...x...x               791.1.24       
  57.2  ISOC   0c 0c 1e cc  1a 63 33 b4  .....c3.               792.1.0        
               77 63 5e 06  18 9d 16 70  wc^....p               792.1.8        
               16 9f 17 71  17 9c 18 72  ...q...r               792.1.16       
               19 9a 1a 6d  19 9a 1a 6d  ...m...m               792.1.24       
  57.2  ISOC   0c 0c 1e cc  1a 63 83 b9  .....c..               793.1.0        
               84 63 6e 06  1b 9d 1a 6e  .cn....n               793.1.8        
               1a a0 1b 6c  1b a0 1c 6c  ...l...l               793.1.16       
               1c a0 1b 6b  1b a2 1d 6c  ...k...l               793.1.24       
  57    ISOC                                                    794.1.0(5)     
  57.2  ISOC   0c 0d 15 ef  ac 62 76 88  .....bv.               799.1.0        
               02 63 ce 05  10 8f 10 7b  .c......               799.1.8        
               10 8d 10 79  10 90 10 77  ...y...w               799.1.16       
               10 92 10 76  10 94 10 77  ...v...w               799.1.24       
  57.2  ISOC   0c 0d 12 a9  88 63 ee de  .....c..               800.1.0        
               df 63 de 06  17 8f 16 74  .c.....t               800.1.8        
               17 8f 15 73  15 91 15 73  ...s...s               800.1.16       
               15 90 15 72  15 90 15 72  ...r...r               800.1.24       
  57.2  ISOC   0c 0d 12 a9  88 63 86 e4  .....c..               801.1.0        
               ec 63 ee 06  10 8b 10 78  .c.....x               801.1.8        
               10 8b 10 77  10 8c 10 77  ...w...w               801.1.16       
               10 8c 10 78  10 8c 10 78  ...x...x               801.1.24       
  57    ISOC                                                    802.1.0(6)     
  57.2  ISOC   0c 0c 1e cc  1a 63 33 b4  .....c3.               808.1.0        
               77 63 5e 06  18 9d 16 70  wc^....p               808.1.8        
               16 9f 17 71  17 9c 18 72  ...q...r               808.1.16       
               19 9a 1a 6d  19 9a 1a 6d  ...m...m               808.1.24       
  57.2  ISOC   0c 0c 14 86  f6 63 ab 13  .....c..               809.1.0        
               55 64 6e 07  12 92 14 74  Udn....t               809.1.8        
               14 91 15 73  15 90 15 72  ...s...r               809.1.16       
               15 91 15 73  14 92 15 74  ...s...t               809.1.24       
  57.2  ISOC   0c 0c 14 86  f6 63 7b 18  .....c..               810.1.0        
               62 64 7e 07  12 8f 12 79  bd.....y               810.1.8        
               11 8d 12 7a  12 8d 12 7a  ...z...z               810.1.16       
               13 8c 12 79  15 8c 11 7a  ...y...z               810.1.24       
  57    ISOC                                                    811.1.0(5)     
  57.2  ISOC   0c 0d 12 a9  88 63 ee de  .....c..               816.1.0        
               df 63 de 06  17 8f 16 74  .c.....t               816.1.8        
               17 8f 15 73  15 91 15 73  ...s...s               816.1.16       
               15 90 15 72  15 90 15 72  ...r...r               816.1.24       
  57.2  ISOC   0c 0d 19 63  64 64 26 3a  ...cdd&:               817.1.0        
               bd 64 ee 07  16 99 16 71  .d.....q               817.1.8        
               15 99 16 72  15 97 15 72  ...r...r               817.1.16       
               14 96 14 75  14 97 15 72  ...u...r               817.1.24       
  57.2  ISOC   0c 0d 19 63  64 64 f6 3e  ...cdd.>               818.1.0        
               ca 64 fe 07  19 9d 19 70  .d.....p               818.1.8        
               19 9b 18 71  18 9a 18 72  ...q...r               818.1.16       
               18 9b 18 70  18 9c 18 70  ...p...p               818.1.24       
  57    ISOC                                                    819.1.0(6)     
  57.2  ISOC   0c 0c 14 86  f6 63 ab 13  .....c..               825.1.0        
               55 64 6e 07  12 92 14 74  Udn....t               825.1.8        
               14 91 15 73  15 90 15 72  ...s...r               825.1.16       
               15 91 15 73  14 92 15 74  ...s...t               825.1.24       
  57.2  ISOC   0c 0c 17 40  d2 64 2b 69  ...@.d+i               826.1.0        
               32 65 7e 00  25 a0 25 65  2e..%.%e               826.1.8        
               23 9e 23 67  22 a2 22 69  #.#g"."i               826.1.16       
               22 a3 22 69  21 a3 21 6b  "."i!.!k               826.1.24       
  57.2  ISOC   0c 0c 17 40  d2 64 9b 6e  ...@.d.n               827.1.0        
               3f 65 8e 00  16 94 16 71  ?e.....q               827.1.8        
               16 95 16 72  16 95 16 73  ...r...s               827.1.16       
               18 94 19 6f  19 91 19 6f  ...o...o               827.1.24       
  57    ISOC                                                    828.1.0(5)     
  57.2  ISOC   0c 0d 19 63  64 64 26 3a  ...cdd&:               833.1.0        
               bd 64 ee 07  16 99 16 71  .d.....q               833.1.8        
               15 99 16 72  15 97 15 72  ...r...r               833.1.16       
               14 96 14 75  14 97 15 72  ...u...r               833.1.24       
  57.2  ISOC   0c 0d 05 1d  40 65 f6 98  ....@e..               834.1.0        
               9a 65 fe 00  11 93 11 73  .e.....s               834.1.8        
               11 91 11 74  10 8f 10 76  ...t...v               834.1.16       
               10 90 10 78  10 90 10 77  ...x...w               834.1.24       
  57.2  ISOC   0c 0d 05 1d  40 65 46 9e  ....@eF.               835.1.0        
               a7 65 0e 01  16 8e 16 72  .e.....r               835.1.8        
               16 8f 16 70  15 92 15 72  ...p...r               835.1.16       
               15 92 15 73  15 91 15 73  ...s...s               835.1.24       
  57    ISOC                                                    836.1.0(5)     
  57.2  ISOC   0c 0c 14 86  f6 63 ab 13  .....c..               841.1.0        
               55 64 6e 07  12 92 14 74  Udn....t               841.1.8        
               14 91 15 73  15 90 15 72  ...s...r               841.1.16       
               15 91 15 73  14 92 15 74  ...s...t               841.1.24       
  57.2  ISOC   0c 0c 14 fa  ad 65 93 c0  .....e..               842.1.0        
               02 66 7e 01  10 8c 10 77  .f.....w               842.1.8        
               10 8e 10 77  10 8f 10 77  ...w...w               842.1.16       
               10 91 10 76  10 90 10 73  ...v...s               842.1.24       
  57.2  ISOC   0c 0c 14 fa  ad 65 5b c5  .....e[.               843.1.0        
               0f 66 8e 01  16 96 15 74  .f.....t               843.1.8        
               17 93 17 73  18 8e 15 72  ...s...r               843.1.16       
               15 8f 15 73  15 8f 15 73  ...s...s               843.1.24       
  57    ISOC                                                    844.1.0(6)     
  57.2  ISOC   0c 0d 05 1d  40 65 f6 98  ....@e..               850.1.0        
               9a 65 fe 00  11 93 11 73  .e.....s               850.1.8        
               11 91 11 74  10 8f 10 76  ...t...v               850.1.16       
               10 90 10 78  10 90 10 77  ...x...w               850.1.24       
  57.2  ISOC   0c 0d 05 d7  1b 66 1e ee  .....f..               851.1.0        
               77 66 0e 02  23 a3 23 69  wf..#.#i               851.1.8        
               25 a2 25 65  25 a1 24 64  %.%e%.$d               851.1.16       
               23 a3 22 65  23 a5 23 67  #."e#.#g               851.1.24       
  57.2  ISOC   0c 0d 05 d7  1b 66 6e f3  .....fn.               852.1.0        
               84 66 1e 02  1a 9e 1c 6d  .f.....m               852.1.8        
               1b 9d 1d 6c  1c 9e 1c 6d  ...l...m               852.1.16       
               1b a1 1d 6b  1b a3 1d 6b  ...k...k               852.1.24       
  57    ISOC                                                    853.1.0(5)     
  57.2  ISOC   0c 0c 14 fa  ad 65 93 c0  .....e..               858.1.0        
               02 66 7e 01  10 8c 10 77  .f.....w               858.1.8        
               10 8e 10 77  10 8f 10 77  ...w...w               858.1.16       
               10 91 10 76  10 90 10 73  ...v...s               858.1.24       
  57.2  ISOC   0c 0c 15 b4  89 66 cf 19  .....f..               859.1.0        
               e0 66 8e 02  10 8a 10 79  .f.....y               859.1.8        
               10 8a 10 7a  10 8a 10 7a  ...z...z               859.1.16       
               10 8a 10 7a  10 8a 10 78  ...z...x               859.1.24       
  57.2  ISOC   0c 0c 15 b4  89 66 6b 23  .....fk#               860.1.0        
               ed 66 9e 02  15 94 15 75  .f.....u               860.1.8        
               15 94 15 74  16 95 16 74  ...t...t               860.1.16       
               16 96 16 73  18 95 18 70  ...s...p               860.1.24       
  57    ISOC                                                    861.1.0(6)     
  57.2  ISOC   0c 0d 05 d7  1b 66 1e ee  .....f..               867.1.0        
               77 66 0e 02  23 a3 23 69  wf..#.#i               867.1.8        
               25 a2 25 65  25 a1 24 64  %.%e%.$d               867.1.16       
               23 a3 22 65  23 a5 23 67  #."e#.#g               867.1.24       
  57.2  ISOC   0c 0d 06 91  f7 66 be 4b  .....f.K               868.1.0        
               55 67 1e 03  15 94 14 75  Ug.....u               868.1.8        
               15 94 14 73  14 94 14 75  ...s...u               868.1.16       
               15 95 15 76  15 98 14 74  ...v...t               868.1.24       
  57.2  ISOC   0c 0d 06 91  f7 66 86 50  .....f.P               869.1.0        
               62 67 2e 03  14 91 15 76  bg.....v               869.1.8        
               15 8d 15 75  14 8f 15 76  ...u...v               869.1.16       
               15 8d 15 77  15 8d 15 77  ...w...w               869.1.24       
  57    ISOC                                                    870.1.0(5)     
  57.2  RESET                                                   875.1.0        
  57.0  CTL    01 0b 00 00  01 00 00 00  SET INTERFACE          876.1.0        
  57.0  CTL    a1 81 00 01  01 00 1a 00  GET CUR                877.1.0        
  57.0  IN     00 00 01 01  15 16 05 00  ........               877.2.0        
               00 00 00 00  00 00 00 00  ........               877.2.8        
               00 00 00 60  09 00 00 0c  ...`....               877.2.16       
               00 00                     ..                     877.2.24       
  57.0  CTL    21 01 00 01  01 00 1a 00  SET CUR                878.1.0        
  57.0  OUT    00 00 01 04  15 16 05 00  ........               878.2.0        
               00 00 00 00  00 00 00 00  ........               878.2.8        
               00 00 00 60  09 00 00 00  ...`....               878.2.16       
               00 00                     ..                     878.2.24       
  57.0  CTL    a1 81 00 01  01 00 1a 00  GET CUR                879.1.0        
  57.0  IN     00 00 01 04  15 16 05 00  ........               879.2.0        
               00 00 00 00  00 00 00 00  ........               879.2.8        
               00 00 00 60  09 00 00 0c  ...`....               879.2.16       
               00 00                     ..                     879.2.24       
  57.0  CTL    a1 83 00 01  01 00 1a 00  GET MAX                880.1.0        
  57.0  IN     00 00 01 04  15 16 05 00  ........               880.2.0        
               00 00 00 00  00 00 00 00  ........               880.2.8        
               00 00 00 60  09 00 00 0c  ...`....               880.2.16       
               00 00                     ..                     880.2.24       
  57.0  CTL    a1 82 00 01  01 00 1a 00  GET MIN                881.1.0        
  57.0  IN     00 00 01 04  15 16 05 00  ........               881.2.0        
               00 00 00 00  00 00 00 00  ........               881.2.8        
               00 00 00 60  09 00 00 0c  ...`....               881.2.16       
               00 00                     ..                     881.2.24       
  57.0  CTL    21 01 00 01  01 00 1a 00  SET CUR                882.1.0        
  57.0  OUT    00 00 01 04  15 16 05 00  ........               882.2.0        
               00 00 00 00  00 00 00 00  ........               882.2.8        
               00 00 00 60  09 00 00 00  ...`....               882.2.16       
               00 00                     ..                     882.2.24       
  57.0  CTL    a1 81 00 01  01 00 1a 00  GET CUR                883.1.0        
  57.0  IN     00 00 01 04  15 16 05 00  ........               883.2.0        
               00 00 00 00  00 00 00 00  ........               883.2.8        
               00 00 00 60  09 00 00 0c  ...`....               883.2.16       
               00 00                     ..                     883.2.24       
  57.0  CTL    21 01 00 02  01 00 1a 00  SET CUR                884.1.0        
  57.0  OUT    00 00 01 04  15 16 05 00  ........               884.2.0        
               00 00 00 00  00 00 00 00  ........               884.2.8        
               00 00 00 60  09 00 00 0c  ...`....               884.2.16       
               00 00                     ..                     884.2.24       
  57.0  CTL    01 0b 01 00  01 00 00 00  SET INTERFACE          885.1.0        
  57    ISOC                                                    886.1.0(9)     
  57.0  CTL    a1 81 00 02  00 02 02 00  GET CUR                895.1.0        
  57.0  IN     80 00                     ..                     895.2.0        
  57.0  CTL    21 01 00 02  00 02 02 00  SET CUR                896.1.0        
  57.0  OUT    80 00                     ..                     896.2.0        
  57.0  CTL    a1 81 00 02  00 02 02 00  GET CUR                897.1.0        
  57.0  IN     80 00                     ..                     897.2.0        
  57    ISOC                                                    898.1.0(24)    
  57.2  ISOC   00 00 00 00  00 00 00 00  ........               922.1.0(3)     
               00 00 00 00  00 00 00 00  ........               922.1.8        
               00 00 00 00  00 00 00 00  ........               922.1.16       
               00 00 00 00  00 00 00 00  ........               922.1.24       
  57    ISOC                                                    925.1.0(5)     
  57.2  ISOC   00 00 00 00  00 00 00 00  ........               930.1.0(3)     
               00 00 00 00  00 00 00 00  ........               930.1.8        
               00 00 00 00  00 00 00 00  ........               930.1.16       
               00 00 00 00  00 00 00 00  ........               930.1.24       
  57    ISOC                                                    933.1.0(5)     
  57.2  ISOC   00 00 00 00  00 00 00 00  ........               938.1.0        
               00 00 00 00  00 00 00 00  ........               938.1.8        
               00 00 00 00  00 00 00 00  ........               938.1.16       
               00 00 00 00  00 00 00 00  ........               938.1.24       
  57.2  ISOC   0c 0c 46 f6  f2 69 fe d3  ..F..i..               939.1.0        
               46 6a bc 06  1a 99 1a 6d  Fj.....m               939.1.8        
               1a 9b 19 6f  1b 9b 1a 6e  ...o...n               939.1.16       
               1a 99 19 71  19 95 17 70  ...q...p               939.1.24       
  57.2  ISOC   0c 0c 46 f6  f2 69 cf d8  ..F..i..               940.1.0        
               53 6a cc 06  27 a5 27 66  Sj..'.'f               940.1.8        
               27 ad 26 66  26 ac 26 67  '.&f&.&g               940.1.16       
               24 a7 25 64  25 a2 27 68  $.%d%.'h               940.1.24       
  57    ISOC                                                    941.1.0(6)     
  57.2  ISOC   00 00 00 00  00 00 00 00  ........               947.1.0        
               00 00 00 00  00 00 00 00  ........               947.1.8        
               00 00 00 00  00 00 00 00  ........               947.1.16       
               00 00 00 00  00 00 00 00  ........               947.1.24       
  57.2  ISOC   0c 0d 47 d3  60 6a 5f 0d  ..G.`j_.               948.1.0        
               bc 6a 4c 07  20 a3 1f 6a  .jL. ..j               948.1.8        
               1f a2 1e 6b  1e a1 1e 6c  ...k...l               948.1.16       
               1d 9e 1d 6b  1d 9c 1a 6e  ...k...n               948.1.24       
  57.2  ISOC   00 00 00 00  00 00 00 00  ........               949.1.0        
               00 00 00 00  00 00 00 00  ........               949.1.8        
               00 00 00 00  00 00 00 00  ........               949.1.16       
               00 00 00 00  00 00 00 00  ........               949.1.24       
  57    ISOC                                                    950.1.0(5)     
  57.2  ISOC   0c 0c 46 f6  f2 69 fe d3  ..F..i..               955.1.0        
               46 6a bc 06  1a 99 1a 6d  Fj.....m               955.1.8        
               1a 9b 19 6f  1b 9b 1a 6e  ...o...n               955.1.16       
               1a 99 19 71  19 95 17 70  ...q...p               955.1.24       
  57.2  ISOC   0c 0c 46 b0  ce 6a df 33  ..F..j.3               956.1.0        
               24 6b cc 07  1c 97 1a 6d  $k.....m               956.1.8        
               1a 99 18 72  19 9b 18 72  ...r...r               956.1.16       
               19 96 18 72  18 95 17 6f  ...r...o               956.1.24       
  57.2  ISOC   00 00 00 00  00 00 00 00  ........               957.1.0        
               00 00 00 00  00 00 00 00  ........               957.1.8        
               00 00 00 00  00 00 00 00  ........               957.1.16       
               00 00 00 00  00 00 00 00  ........               957.1.24       
  57    ISOC                                                    958.1.0(6)     
  57.2  ISOC   0c 0d 47 d3  60 6a 5f 0d  ..G.`j_.               964.1.0        
               bc 6a 4c 07  20 a3 1f 6a  .jL. ..j               964.1.8        
               1f a2 1e 6b  1e a1 1e 6c  ...k...l               964.1.16       
               1d 9e 1d 6b  1d 9c 1a 6e  ...k...n               964.1.24       
  57.2  ISOC   0c 0d 44 8d  3c 6b 2e 5f  ..D.<k._               965.1.0        
               99 6b 5c 00  23 a8 22 69  .k\.#."i               965.1.8        
               23 a2 23 68  22 a3 23 69  #.#h".#i               965.1.16       
               23 a5 22 6a  21 a7 21 69  #."j!.!i               965.1.24       
  57.2  ISOC   0c 0d 44 8d  3c 6b ff 63  ..D.<k.c               966.1.0        
               a6 6b 6c 00  1d a6 1e 6a  .kl....j               966.1.8        
               1e a2 1e 6b  1e a2 1c 6d  ...k...m               966.1.16       
               1d a0 1d 6c  1e 9f 1e 6c  ...l...l               966.1.24       
  57    ISOC                                                    967.1.0(5)     
  57.2  ISOC   0c 0c 46 b0  ce 6a df 33  ..F..j.3               972.1.0        
               24 6b cc 07  1c 97 1a 6d  $k.....m               972.1.8        
               1a 99 18 72  19 9b 18 72  ...r...r               972.1.16       
               19 96 18 72  18 95 17 6f  ...r...o               972.1.24       
  57.2  ISOC   0c 0c 47 6a  aa 6b be 93  ..Gj.k..               973.1.0        
               01 6c dc 00  1a 99 19 71  .l.....q               973.1.8        
               1a 9b 1a 75  1a 9a 19 70  ...u...p               973.1.16       
               18 99 17 73  18 95 17 6f  ...s...o               973.1.24       
  57.2  ISOC   0c 0c 47 6a  aa 6b 8f 98  ..Gj.k..               974.1.0        
               0e 6c ec 00  20 a1 1e 6c  .l.. ..l               974.1.8        
               1f a1 1e 6b  1e a0 1f 6a  ...k...j               974.1.16       
               1e a2 20 6b  21 a2 1f 6b  .. k!..k               974.1.24       
  57    ISOC                                                    975.1.0(6)     
  57.2  ISOC   0c 0d 44 8d  3c 6b 2e 5f  ..D.<k._               981.1.0        
               99 6b 5c 00  23 a8 22 69  .k\.#."i               981.1.8        
               23 a2 23 68  22 a3 23 69  #.#h".#i               981.1.16       
               23 a5 22 6a  21 a7 21 69  #."j!.!i               981.1.24       
  57.2  ISOC   0c 0d 46 47  18 6c 1e cd  ..FG.l..               982.1.0        
               76 6c 6c 01  22 a6 21 67  vll.".!g               982.1.8        
               21 aa 23 67  22 a5 23 67  !.#g".#g               982.1.16       
               21 a9 22 63  23 a8 22 6a  !."c#."j               982.1.24       
  57.2  ISOC   0c 0d 46 47  18 6c de c3  ..FG.l..               983.1.0        
               83 6c 7c 01  19 9e 19 70  .l.....p               983.1.8        
               1a 99 1b 6e  19 9c 1a 6f  ...n...o               983.1.16       
               1a 97 19 70  1a 9b 1b 6d  ...p...m               983.1.24       
  57    ISOC                                                    984.1.0(5)     
  57.2  ISOC   0c 0c 47 6a  aa 6b be 93  ..Gj.k..               989.1.0        
               01 6c dc 00  1a 99 19 71  .l.....q               989.1.8        
               1a 9b 1a 75  1a 9a 19 70  ...u...p               989.1.16       
               18 99 17 73  18 95 17 6f  ...s...o               989.1.24       
  57.2  ISOC   0c 0c 47 24  86 6c 9f f3  ..G$.l..               990.1.0        
               de 6c ec 01  1d 9a 1d 6b  .l.....k               990.1.8        
               1d 97 1c 6e  1a 99 1b 6c  ...n...l               990.1.16       
               1b 98 1a 6d  19 9f 19 71  ...m...q               990.1.24       
  57.2  ISOC   0c 0c 47 24  86 6c 5e ea  ..G$.l^.               991.1.0        
               eb 6c fc 01  20 a7 1f 69  .l.. ..i               991.1.8        
               1f a3 1e 6c  20 a3 1d 6e  ...l ..n               991.1.16       
               1e a7 1e 6a  1e a1 1f 69  ...j...i               991.1.24       
  57    ISOC                                                    992.1.0(6)     
  57.2  ISOC   0c 0d 46 47  18 6c 1e cd  ..FG.l..               998.1.0        
               76 6c 6c 01  22 a6 21 67  vll.".!g               998.1.8        
               21 aa 23 67  22 a5 23 67  !.#g".#g               998.1.16       
               21 a9 22 63  23 a8 22 6a  !."c#."j               998.1.24       
  57.2  ISOC   0c 0d 43 01  f4 6c ee 1e  ..C..l..               999.1.0        
               54 6d 7c 02  27 a6 26 66  Tm..'.&f               999.1.8        
               26 a7 26 64  25 a7 25 65  &.&d%.%e               999.1.16       
               24 a6 24 63  25 a0 25 69  $.$c%.%i               999.1.24       
  57.2  ISOC   0c 0d 43 01  f4 6c bf 23  ..C..l.#              1000.1.0        
               61 6d 8c 02  1a 9e 19 6e  am.....n              1000.1.8        
               1a 9e 1b 6c  1b 9b 1a 6e  ...l...n              1000.1.16       
               1a 9b 1d 6b  1d 95 1a 6d  ...k...m              1000.1.24       
  57    ISOC                                                   1001.1.0(5)     
  57.2  ISOC   0c 0c 47 24  86 6c 9f f3  ..G$.l..              1006.1.0        
               de 6c ec 01  1d 9a 1d 6b  .l.....k              1006.1.8        
               1d 97 1c 6e  1a 99 1b 6c  ...n...l              1006.1.16       
               1b 98 1a 6d  19 9f 19 71  ...m...q              1006.1.24       
  57.2  ISOC   0c 0c 47 24  86 6c 5e ea  ..G$.l^.              1007.1.0        
               eb 6c fc 01  20 a7 1f 69  .l.. ..i              1007.1.8        
               1f a3 1e 6c  20 a3 1d 6e  ...l ..n              1007.1.16       
               1e a7 1e 6a  1e a1 1f 69  ...j...i              1007.1.24       
  57.2  ISOC   0c 0c 48 de  61 6d 4f 58  ..H.amOX              1008.1.0        
               c9 6d 0c 03  1c 9b 1d 6d  .m.....m              1008.1.8        
               1c 98 1d 6d  1d 98 1c 70  ...m...p              1008.1.16       
               1b 9a 1c 6f  1a 9a 1b 71  ...o...q              1008.1.24       
  57    ISOC                                                   1009.1.0(5)     
  57.2  ISOC   0c 0d 46 47  18 6c 1e cd  ..FG.l..              1014.1.0        
               76 6c 6c 01  22 a6 21 67  vll.".!g              1014.1.8        
               21 aa 23 67  22 a5 23 67  !.#g".#g              1014.1.16       
               21 a9 22 63  23 a8 22 6a  !."c#."j              1014.1.24       
  57.2  ISOC   0c 0d 43 01  f4 6c ee 1e  ..C..l..              1015.1.0        
               54 6d 7c 02  27 a6 26 66  Tm..'.&f              1015.1.8        
               26 a7 26 64  25 a7 25 65  &.&d%.%e              1015.1.16       
               24 a6 24 63  25 a0 25 69  $.$c%.%i              1015.1.24       
  57.2  ISOC   0c 0d 43 01  f4 6c bf 23  ..C..l.#              1016.1.0        
               61 6d 8c 02  1a 9e 19 6e  am.....n              1016.1.8        
               1a 9e 1b 6c  1b 9b 1a 6e  ...l...n              1016.1.16       
               1a 9b 1d 6b  1d 95 1a 6d  ...k...m              1016.1.24       
  57    ISOC                                                   1017.1.0(6)     
  57.2  ISOC   0c 0c 47 24  86 6c 5e ea  ..G$.l^.              1023.1.0        
               eb 6c fc 01  20 a7 1f 69  .l.. ..i              1023.1.8        
               1f a3 1e 6c  20 a3 1d 6e  ...l ..n              1023.1.16       
               1e a7 1e 6a  1e a1 1f 69  ...j...i              1023.1.24       
  57.2  ISOC   0c 0c 48 de  61 6d 4f 58  ..H.amOX              1024.1.0        
               c9 6d 0c 03  1c 9b 1d 6d  .m.....m              1024.1.8        
               1c 98 1d 6d  1d 98 1c 70  ...m...p              1024.1.16       
               1b 9a 1c 6f  1a 9a 1b 71  ...o...q              1024.1.24       
  57.2  ISOC   0c 0c 48 98  3d 6e 1e aa  ..H.=n..              1025.1.0        
               a6 6e 1c 04  1e 9e 1d 6c  .n.....l              1025.1.8        
               1e a5 1e 6b  20 a2 1d 6e  ...k ..n              1025.1.16       
               1e a3 1d 6b  1e a6 1d 6c  ...k...l              1025.1.24       
  57    ISOC                                                   1026.1.0(5)     
  57.2  ISOC   0c 0d 43 01  f4 6c ee 1e  ..C..l..              1031.1.0        
               54 6d 7c 02  27 a6 26 66  Tm..'.&f              1031.1.8        
               26 a7 26 64  25 a7 25 65  &.&d%.%e              1031.1.16       
               24 a6 24 63  25 a0 25 69  $.$c%.%i              1031.1.24       
  57.2  ISOC   0c 0d 43 01  f4 6c bf 23  ..C..l.#              1032.1.0        
               61 6d 8c 02  1a 9e 19 6e  am.....n              1032.1.8        
               1a 9e 1b 6c  1b 9b 1a 6e  ...l...n              1032.1.16       
               1a 9b 1d 6b  1d 95 1a 6d  ...k...m              1032.1.24       
  57.2  ISOC   00 00 00 00  00 00 00 00  ........              1033.1.0        
               00 00 00 00  00 00 00 00  ........              1033.1.8        
               00 00 00 00  00 00 00 00  ........              1033.1.16       
               00 00 00 00  00 00 00 00  ........              1033.1.24       
  57    ISOC                                                   1034.1.0(6)     
  57.2  ISOC   0c 0c 48 de  61 6d 4f 58  ..H.amOX              1040.1.0        
               c9 6d 0c 03  1c 9b 1d 6d  .m.....m              1040.1.8        
               1c 98 1d 6d  1d 98 1c 70  ...m...p              1040.1.16       
               1b 9a 1c 6f  1a 9a 1b 71  ...o...q              1040.1.24       
  57.2  ISOC   0c 0c 48 98  3d 6e 1e aa  ..H.=n..              1041.1.0        
               a6 6e 1c 04  1e 9e 1d 6c  .n.....l              1041.1.8        
               1e a5 1e 6b  20 a2 1d 6e  ...k ..n              1041.1.16       
               1e a3 1d 6b  1e a6 1d 6c  ...k...l              1041.1.24       
  57.2  ISOC   00 00 00 00  00 00 00 00  ........              1042.1.0        
               00 00 00 00  00 00 00 00  ........              1042.1.8        
               00 00 00 00  00 00 00 00  ........              1042.1.16       
               00 00 00 00  00 00 00 00  ........              1042.1.24       
  57    ISOC                                                   1043.1.0(5)     
  57.2  ISOC   0c 0d 43 01  f4 6c bf 23  ..C..l.#              1048.1.0        
               61 6d 8c 02  1a 9e 19 6e  am.....n              1048.1.8        
               1a 9e 1b 6c  1b 9b 1a 6e  ...l...n              1048.1.16       
               1a 9b 1d 6b  1d 95 1a 6d  ...k...m              1048.1.24       
  57.2  ISOC   0c 0d 43 2f  87 6f 9f 1d  ..C/.o..              1049.1.0        
               df 6f 9c 05  1c 95 1c 6f  .o.....o              1049.1.8        
               1a 9b 1a 70  1a 99 19 6f  ...p...o              1049.1.16       
               19 97 19 71  18 98 1a 6f  ...q...o              1049.1.24       
  57.2  ISOC   00 00 00 00  00 00 00 00  ........              1050.1.0        
               00 00 00 00  00 00 00 00  ........              1050.1.8        
               00 00 00 00  00 00 00 00  ........              1050.1.16       
               00 00 00 00  00 00 00 00  ........              1050.1.24       
  57    ISOC                                                   1051.1.0(6)     
  57.2  ISOC   0c 0c 48 98  3d 6e 1e aa  ..H.=n..              1057.1.0        
               a6 6e 1c 04  1e 9e 1d 6c  .n.....l              1057.1.8        
               1e a5 1e 6b  20 a2 1d 6e  ...k ..n              1057.1.16       
               1e a3 1d 6b  1e a6 1d 6c  ...k...l              1057.1.24       
  57.2  ISOC   00 00 00 00  00 00 00 00  ........              1058.1.0(2)     
               00 00 00 00  00 00 00 00  ........              1058.1.8        
               00 00 00 00  00 00 00 00  ........              1058.1.16       
               00 00 00 00  00 00 00 00  ........              1058.1.24       
  57    ISOC                                                   1060.1.0(5)     
  57.2  ISOC   0c 0d 43 2f  87 6f 9f 1d  ..C/.o..              1065.1.0        
               df 6f 9c 05  1c 95 1c 6f  .o.....o              1065.1.8        
               1a 9b 1a 70  1a 99 19 6f  ...p...o              1065.1.16       
               19 97 19 71  18 98 1a 6f  ...q...o              1065.1.24       
  57.2  ISOC   00 00 00 00  00 00 00 00  ........              1066.1.0        
               00 00 00 00  00 00 00 00  ........              1066.1.8        
               00 00 00 00  00 00 00 00  ........              1066.1.16       
               00 00 00 00  00 00 00 00  ........              1066.1.24       
  57.2  ISOC   0c 0c 46 f6  f2 69 fe d3  ..F..i..              1067.1.0        
               46 6a bc 06  1a 99 1a 6d  Fj.....m              1067.1.8        
               1a 9b 19 6f  1b 9b 1a 6e  ...o...n              1067.1.16       
               1a 99 19 71  19 95 17 70  ...q...p              1067.1.24       
  57    ISOC                                                   1068.1.0(5)     
  57.2  ISOC   0c 0c 48 98  3d 6e 1e aa  ..H.=n..              1073.1.0        
               a6 6e 1c 04  1e 9e 1d 6c  .n.....l              1073.1.8        
               1e a5 1e 6b  20 a2 1d 6e  ...k ..n              1073.1.16       
               1e a3 1d 6b  1e a6 1d 6c  ...k...l              1073.1.24       
  57.2  ISOC   0c 0c 4b c6  d0 70 fe a3  ..K..p..              1074.1.0        
               24 71 2c 07  1b 99 1a 6e  $q,....n              1074.1.8        
               19 9f 19 70  1b 9b 1b 6c  ...p...l              1074.1.16       
               1a 9b 18 72  19 97 17 72  ...r...r              1074.1.24       
  57.2  ISOC   0c 0c 4b c6  d0 70 cf a8  ..K..p..              1075.1.0        
               31 71 3c 07  26 a8 28 65  1q<.&.(e              1075.1.8        
               27 a8 27 64  25 a8 26 65  '.'d%.&e              1075.1.16       
               25 a7 25 69  25 a1 26 6c  %.%i%.&l              1075.1.24       
  57    ISOC                                                   1076.1.0(6)     
  57.2  ISOC   00 00 00 00  00 00 00 00  ........              1082.1.0        
               00 00 00 00  00 00 00 00  ........              1082.1.8        
               00 00 00 00  00 00 00 00  ........              1082.1.16       
               00 00 00 00  00 00 00 00  ........              1082.1.24       
  57.2  ISOC   0c 0d 46 a3  3e 71 5f dd  ..F.>q_.              1083.1.0        
               99 71 bc 07  1f 9f 20 67  .q.... g              1083.1.8        
               1e 9f 1d 68  1f 9c 1e 68  ...h...h              1083.1.16       
               1e 9b 1d 6b  1d 9b 1d 6b  ...k...k              1083.1.24       
  57.2  ISOC   0c 0d 46 a3  3e 71 1e d4  ..F.>q..              1084.1.0        
               a6 71 cc 07  1d 9e 1b 6b  .q.....k              1084.1.8        
               1c 9f 1b 6b  1d 9f 1d 69  ...k...i              1084.1.16       
               1b 9f 1d 6b  1b a1 1e 6b  ...k...k              1084.1.24       
  57    ISOC                                                   1085.1.0(5)     
  57.2  RESET                                                  1090.1.0        
  57.0  CTL    01 0b 00 00  01 00 00 00  SET INTERFACE         1091.1.0        
  57.0  CTL    a1 81 00 01  01 00 1a 00  GET CUR               1092.1.0        
  57.0  IN     00 00 01 04  15 16 05 00  ........              1092.2.0        
               00 00 00 00  00 00 00 00  ........              1092.2.8        
               00 00 00 60  09 00 00 0c  ...`....              1092.2.16       
               00 00                     ..                    1092.2.24       
  57.0  CTL    21 01 00 01  01 00 1a 00  SET CUR               1093.1.0        
  57.0  OUT    00 00 01 02  15 16 05 00  ........              1093.2.0        
               00 00 00 00  00 00 00 00  ........              1093.2.8        
               00 00 00 60  09 00 00 00  ...`....              1093.2.16       
               00 00                     ..                    1093.2.24       
  57.0  CTL    a1 81 00 01  01 00 1a 00  GET CUR               1094.1.0        
  57.0  IN     00 00 01 02  15 16 05 00  ........              1094.2.0        
               00 00 00 00  00 00 00 00  ........              1094.2.8        
               00 00 00 60  09 00 00 0c  ...`....              1094.2.16       
               00 00                     ..                    1094.2.24       
  57.0  CTL    a1 83 00 01  01 00 1a 00  GET MAX               1095.1.0        
  57.0  IN     00 00 01 02  15 16 05 00  ........              1095.2.0        
               00 00 00 00  00 00 00 00  ........              1095.2.8        
               00 00 00 60  09 00 00 0c  ...`....              1095.2.16       
               00 00                     ..                    1095.2.24       
  57.0  CTL    a1 82 00 01  01 00 1a 00  GET MIN               1096.1.0        
  57.0  IN     00 00 01 02  15 16 05 00  ........              1096.2.0        
               00 00 00 00  00 00 00 00  ........              1096.2.8        
               00 00 00 60  09 00 00 0c  ...`....              1096.2.16       
               00 00                     ..                    1096.2.24       
  57.0  CTL    21 01 00 01  01 00 1a 00  SET CUR               1097.1.0        
  57.0  OUT    00 00 01 02  15 16 05 00  ........              1097.2.0        
               00 00 00 00  00 00 00 00  ........              1097.2.8        
               00 00 00 60  09 00 00 00  ...`....              1097.2.16       
               00 00                     ..                    1097.2.24       
  57.0  CTL    a1 81 00 01  01 00 1a 00  GET CUR               1098.1.0        
  57.0  IN     00 00 01 02  15 16 05 00  ........              1098.2.0        
               00 00 00 00  00 00 00 00  ........              1098.2.8        
               00 00 00 60  09 00 00 0c  ...`....              1098.2.16       
               00 00                     ..                    1098.2.24       
  57.0  CTL    21 01 00 02  01 00 1a 00  SET CUR               1099.1.0        
  57.0  OUT    00 00 01 02  15 16 05 00  ........              1099.2.0        
               00 00 00 00  00 00 00 00  ........              1099.2.8        
               00 00 00 60  09 00 00 0c  ...`....              1099.2.16       
               00 00                     ..                    1099.2.24       
  57.0  CTL    01 0b 01 00  01 00 00 00  SET INTERFACE         1100.1.0        
  57    ISOC                                                   1101.1.0(4)     
  57.0  CTL    a1 81 00 02  00 02 02 00  GET CUR               1105.1.0        
  57.0  IN     80 00                     ..                    1105.2.0        
  57.0  CTL    21 01 00 02  00 02 02 00  SET CUR               1106.1.0        
  57.0  OUT    80 00                     ..                    1106.2.0        
  57.0  CTL    a1 81 00 02  00 02 02 00  GET CUR               1107.1.0        
  57.0  IN     80 00                     ..                    1107.2.0        
  57    ISOC                                                   1108.1.0(29)    
  57.2  ISOC   00 00 00 00  00 00 00 00  ........              1137.1.0        
               00 00 00 00  00 00 00 00  ........              1137.1.8        
               00 00 00 00  00 00 00 00  ........              1137.1.16       
               00 00 00 00  00 00 00 00  ........              1137.1.24       
  57.2  ISOC   0c 0c 48 80  ac 71 31 8b  ..H..q1.              1138.1.0        
               bd 73 5d 02  1b a1 1d 6b  .s]....k              1138.1.8        
               1e a2 1e 6c  1f a3 20 6a  ...l.. j              1138.1.16       
               1f a0 1d 6c  1e a4 1f 68  ...l...h              1138.1.24       
  57.2  ISOC   0c 0c 48 80  ac 71 86 83  ..H..q..              1139.1.0        
               ca 73 6d 02  15 92 15 84  .sm.....              1139.1.8        
               16 8e 15 80  15 8b 14 81  ........              1139.1.16       
               14 8c 15 80  15 8f 16 7b  ........              1139.1.24       
  57    ISOC                                                   1140.1.0(5)     
  57.2  ISOC   00 00 00 00  00 00 00 00  ........              1145.1.0        
               00 00 00 00  00 00 00 00  ........              1145.1.8        
               00 00 00 00  00 00 00 00  ........              1145.1.16       
               00 00 00 00  00 00 00 00  ........              1145.1.24       
  57.2  ISOC   0c 0d 9b ce  cb 73 ae b3  .....s..              1146.1.0        
               25 74 dd 02  1f a0 1f 6a  %t.....j              1146.1.8        
               1d 9f 1e 69  1f 9f 1f 69  ...i...i              1146.1.16       
               20 9d 20 6c  1d 9f 1c 6d   . l...m              1146.1.24       
  57.2  ISOC   0c 0d 9b ce  cb 73 25 c6  .....s%.              1147.1.0        
               32 74 ed 02  18 9b 17 73  2t.....s              1147.1.8        
               16 99 17 6f  17 99 17 6f  ...o...o              1147.1.16       
               18 9b 19 70  19 9e 19 6f  ...p...o              1147.1.24       
  57    ISOC                                                   1148.1.0(5)     
  57.2  ISOC   00 00 00 00  00 00 00 00  ........              1153.1.0        
               00 00 00 00  00 00 00 00  ........              1153.1.8        
               00 00 00 00  00 00 00 00  ........              1153.1.16       
               00 00 00 00  00 00 00 00  ........              1153.1.24       
  57.2  ISOC   0c 0c 99 ab  39 74 c6 d9  ....9t..              1154.1.0        
               8d 74 5d 03  11 94 12 75  .t]....u              1154.1.8        
               11 95 11 75  11 95 11 75  ...u...u              1154.1.16       
               10 97 11 79  11 97 11 77  ...y...w              1154.1.24       
  57.2  ISOC   0c 0c 99 ab  39 74 ce e1  ....9t..              1155.1.0        
               9a 74 6d 03  1a 96 1c 6e  .tm....n              1155.1.8        
               1a 99 1c 6d  1c 9c 1d 6c  ...m...l              1155.1.16       
               1e 9b 1e 6e  1d 9f 20 69  ...n.. i              1155.1.24       
  57    ISOC                                                   1156.1.0(6)     
  57.2  ISOC   0c 0d 9b ce  cb 73 ae b3  .....s..              1162.1.0        
               25 74 dd 02  1f a0 1f 6a  %t.....j              1162.1.8        
               1d 9f 1e 69  1f 9f 1f 69  ...i...i              1162.1.16       
               20 9d 20 6c  1d 9f 1c 6d   . l...m              1162.1.24       
  57.2  ISOC   0c 0d 99 88  a7 74 26 13  .....t&.              1163.1.0        
               03 75 ed 03  17 9d 16 72  .u.....r              1163.1.8        
               16 99 16 71  16 98 15 70  ...q...p              1163.1.16       
               15 99 15 72  16 9a 16 70  ...r...p              1163.1.24       
  57.2  ISOC   0c 0d 99 88  a7 74 cd 09  .....t..              1164.1.0        
               10 75 fd 03  19 91 18 73  .u.....s              1164.1.8        
               19 95 19 72  1a 96 19 71  ...r...q              1164.1.16       
               18 98 18 73  18 97 19 71  ...s...q              1164.1.24       
  57    ISOC                                                   1165.1.0(5)     
  57.2  ISOC   0c 0c 99 ab  39 74 c6 d9  ....9t..              1170.1.0        
               8d 74 5d 03  11 94 12 75  .t]....u              1170.1.8        
               11 95 11 75  11 95 11 75  ...u...u              1170.1.16       
               10 97 11 79  11 97 11 77  ...y...w              1170.1.24       
  57.2  ISOC   0c 0c 9c 65  15 75 a8 39  ...e.u.9              1171.1.0        
               6b 75 6d 04  19 98 19 6e  kum....n              1171.1.8        
               19 98 19 6d  19 98 19 70  ...m...p              1171.1.16       
               19 98 17 70  17 9c 19 6e  ...p...n              1171.1.24       
  57.2  ISOC   0c 0c 9c 65  15 75 78 3e  ...e.ux>              1172.1.0        
               78 75 7d 04  18 9d 17 71  xu.....q              1172.1.8        
               18 9a 1a 70  1a 9d 19 70  ...p...p              1172.1.16       
               1c a0 1c 71  1c 9d 1c 70  ...q...p              1172.1.24       
  57    ISOC                                                   1173.1.0(6)     
  57.2  ISOC   0c 0d 99 88  a7 74 26 13  .....t&.              1179.1.0        
               03 75 ed 03  17 9d 16 72  .u.....r              1179.1.8        
               16 99 16 71  16 98 15 70  ...q...p              1179.1.16       
               15 99 15 72  16 9a 16 70  ...r...p              1179.1.24       
  57.2  ISOC   0c 0d 9b 42  83 75 06 73  ...B.u.s              1180.1.0        
               e0 75 fd 04  1a 9f 1b 6e  .u.....n              1180.1.8        
               1b 9f 1b 6b  1b a0 1a 6c  ...k...l              1180.1.16       
               1a 9f 19 6e  1a 9e 1a 6e  ...n...n              1180.1.24       
  57.2  ISOC   0c 0d 9b 42  83 75 16 66  ...B.u.f              1181.1.0        
               ed 75 0d 05  15 8e 15 79  .u.....y              1181.1.8        
               15 89 15 7b  15 8a 15 78  .......x              1181.1.16       
               14 88 14 77  13 89 12 78  ...w...x              1181.1.24       
  57    ISOC                                                   1182.1.0(5)     
  57.2  ISOC   0c 0c 9c 65  15 75 a8 39  ...e.u.9              1187.1.0        
               6b 75 6d 04  19 98 19 6e  kum....n              1187.1.8        
               19 98 19 6d  19 98 19 70  ...m...p              1187.1.16       
               19 98 17 70  17 9c 19 6e  ...p...n              1187.1.24       
  57.2  ISOC   0c 0c 9c 1f  f1 75 8b 99  .....u..              1188.1.0        
               48 76 7d 05  10 8e 10 78  Hv.....x              1188.1.8        
               10 8c 10 79  10 8b 10 79  ...y...y              1188.1.16       
               10 89 10 7a  10 8b 10 79  ...z...y              1188.1.24       
  57.2  ISOC   0c 0c 9c 1f  f1 75 d1 9a  .....u..              1189.1.0        
               55 76 8d 05  17 9e 17 6f  Uv.....o              1189.1.8        
               16 9d 17 74  16 9e 18 72  ...t...r              1189.1.16       
               18 9c 18 72  19 9b 18 71  ...r...q              1189.1.24       
  57    ISOC                                                   1190.1.0(6)     
  57.2  ISOC   0c 0d 9b 42  83 75 06 73  ...B.u.s              1196.1.0        
               e0 75 fd 04  1a 9f 1b 6e  .u.....n              1196.1.8        
               1b 9f 1b 6b  1b a0 1a 6c  ...k...l              1196.1.16       
               1a 9f 19 6e  1a 9e 1a 6e  ...n...n              1196.1.24       
  57.2  ISOC   0c 0d 9b 42  83 75 16 66  ...B.u.f              1197.1.0        
               ed 75 0d 05  15 8e 15 79  .u.....y              1197.1.8        
               15 89 15 7b  15 8a 15 78  .......x              1197.1.16       
               14 88 14 77  13 89 12 78  ...w...x              1197.1.24       
  57.2  ISOC   0c 0d 9e fc  5e 76 a6 c9  ....^v..              1198.1.0        
               ca 76 1d 06  19 92 1c 6f  .v.....o              1198.1.8        
               1b 8f 19 73  19 95 19 74  ...s...t              1198.1.16       
               19 94 17 75  18 93 18 74  ...u...t              1198.1.24       
  57    ISOC                                                   1199.1.0(5)     
  57.2  ISOC   0c 0c 9c 1f  f1 75 8b 99  .....u..              1204.1.0        
               48 76 7d 05  10 8e 10 78  Hv.....x              1204.1.8        
               10 8c 10 79  10 8b 10 79  ...y...y              1204.1.16       
               10 89 10 7a  10 8b 10 79  ...z...y              1204.1.24       
  57.2  ISOC   0c 0c a0 d9  cc 76 66 f9  .....vf.              1205.1.0        
               25 77 8d 06  1e a2 1e 6a  %w.....j              1205.1.8        
               1f 9f 1d 6c  1d 9e 1d 6d  ...l...m              1205.1.16       
               1d a1 1e 6a  1d a0 1d 6c  ...j...l              1205.1.24       
  57.2  ISOC   0c 0c a0 d9  cc 76 81 f3  .....v..              1206.1.0        
               32 77 9d 06  14 92 14 74  2w.....t              1206.1.8        
               14 91 14 74  15 8f 15 73  ...t...s              1206.1.16       
               14 8f 14 75  13 93 15 74  ...u...t              1206.1.24       
  57    ISOC                                                   1207.1.0(6)     
  57.2  ISOC   0c 0d 9b 42  83 75 16 66  ...B.u.f              1213.1.0        
               ed 75 0d 05  15 8e 15 79  .u.....y              1213.1.8        
               15 89 15 7b  15 8a 15 78  .......x              1213.1.16       
               14 88 14 77  13 89 12 78  ...w...x              1213.1.24       
  57.2  ISOC   0c 0d 9e fc  5e 76 a6 c9  ....^v..              1214.1.0        
               ca 76 1d 06  19 92 1c 6f  .v.....o              1214.1.8        
               1b 8f 19 73  19 95 19 74  ...s...t              1214.1.16       
               19 94 17 75  18 93 18 74  ...u...t              1214.1.24       
  57.2  ISOC   0c 0d 9f b6  3a 77 86 29  ....:w.)              1215.1.0        
               a8 77 2d 07  10 8a 10 7e  .w-.....              1215.1.8        
               10 8a 10 81  10 8a 10 83  ........              1215.1.16       
               11 88 11 84  11 89 12 86  ........              1215.1.24       
  57    ISOC                                                   1216.1.0(5)     
  57.2  ISOC   0c 0c a0 d9  cc 76 66 f9  .....vf.              1221.1.0        
               25 77 8d 06  1e a2 1e 6a  %w.....j              1221.1.8        
               1f 9f 1d 6c  1d 9e 1d 6d  ...l...m              1221.1.16       
               1d a1 1e 6a  1d a0 1d 6c  ...j...l              1221.1.24       
  57.2  ISOC   0c 0c a0 d9  cc 76 81 f3  .....v..              1222.1.0        
               32 77 9d 06  14 92 14 74  2w.....t              1222.1.8        
               14 91 14 74  15 8f 15 73  ...t...s              1222.1.16       
               14 8f 14 75  13 93 15 74  ...u...t              1222.1.24       
  57.2  ISOC   0c 0c 9c 93  a8 77 06 50  .....w.P              1223.1.0        
               10 78 ad 07  19 97 19 73  .x.....s              1223.1.8        
               1a 97 18 73  17 9a 16 73  ...s...s              1223.1.16       
               17 9c 17 71  16 9d 18 70  ...q...p              1223.1.24       
  57    ISOC                                                   1224.1.0(5)     
  57.2  ISOC   0c 0d 9b 42  83 75 16 66  ...B.u.f              1229.1.0        
               ed 75 0d 05  15 8e 15 79  .u.....y              1229.1.8        
               15 89 15 7b  15 8a 15 78  .......x              1229.1.16       
               14 88 14 77  13 89 12 78  ...w...x              1229.1.24       
  57.2  ISOC   0c 0d 9e 70  16 78 cb 7f  ...p.x..              1230.1.0        
               6b 78 1d 00  13 95 14 73  kx.....s              1230.1.8        
               14 95 14 75  15 95 15 76  ...u...v              1230.1.16       
               15 95 15 72  16 98 17 71  ...r...q              1230.1.24       
  57.2  ISOC   0c 0d 9e 70  16 78 86 76  ...p.x.v              1231.1.0        
               78 78 2d 00  27 a4 26 66  xx-.'.&f              1231.1.8        
               24 a6 24 6a  25 a7 25 65  $.$j%.%e              1231.1.16       
               25 a6 26 65  25 a1 23 69  %.&e%.#i              1231.1.24       
  57    ISOC                                                   1232.1.0(6)     
  57.2  ISOC   0c 0c a0 d9  cc 76 81 f3  .....v..              1238.1.0        
               32 77 9d 06  14 92 14 74  2w.....t              1238.1.8        
               14 91 14 74  15 8f 15 73  ...t...s              1238.1.16       
               14 8f 14 75  13 93 15 74  ...u...t              1238.1.24       
  57.2  ISOC   0c 0c 9c 4d  84 78 87 a2  ...M.x..              1239.1.0        
               e0 78 ad 00  19 9b 19 70  .x.....p              1239.1.8        
               1a 9a 1a 6f  17 96 17 7d  ...o....              1239.1.16       
               16 93 14 79  12 8d 11 7b  ...y....              1239.1.24       
  57.2  ISOC   0c 0c 9c 4d  84 78 e6 af  ...M.x..              1240.1.0        
               ed 78 bd 00  1b 93 19 72  .x.....r              1240.1.8        
               19 96 19 73  19 97 17 74  ...s...t              1240.1.16       
               18 98 19 75  1a 97 1b 72  ...u...r              1240.1.24       
  57    ISOC                                                   1241.1.0(5)     
  57.2  ISOC   0c 0d 9e 70  16 78 cb 7f  ...p.x..              1246.1.0        
               6b 78 1d 00  13 95 14 73  kx.....s              1246.1.8        
               14 95 14 75  15 95 15 76  ...u...v              1246.1.16       
               15 95 15 72  16 98 17 71  ...r...q              1246.1.24       
  57.2  ISOC   0c 0d 9c 2a  f2 78 86 c3  ...*.x..              1247.1.0        
               48 79 2d 01  14 96 15 73  Hy-....s              1247.1.8        
               14 99 14 74  15 9a 16 71  ...t...q              1247.1.16       
               17 96 17 71  17 97 17 70  ...q...p              1247.1.24       
  57.2  ISOC   0c 0d 9c 2a  f2 78 6d d6  ...*.xm.              1248.1.0        
               55 79 3d 01  17 9e 16 73  Uy=....s              1248.1.8        
               18 9d 18 71  19 9e 19 70  ...q...p              1248.1.16       
               18 9b 1a 71  1c 9c 1d 6f  ...q...o              1248.1.24       
  57    ISOC                                                   1249.1.0(6)     
  57.2  ISOC   0c 0c 9c 4d  84 78 87 a2  ...M.x..              1255.1.0        
               e0 78 ad 00  19 9b 19 70  .x.....p              1255.1.8        
               1a 9a 1a 6f  17 96 17 7d  ...o....              1255.1.16       
               16 93 14 79  12 8d 11 7b  ...y....              1255.1.24       
  57.2  ISOC   0c 0c 9c 07  60 79 07 fd  ....`y..              1256.1.0        
               bd 79 bd 01  22 a6 23 66  .y..".#f              1256.1.8        
               23 a8 23 67  24 a9 26 66  #.#g$.&f              1256.1.16       
               25 a7 25 66  25 a9 24 66  %.%f%.$f              1256.1.24       
  57.2  ISOC   0c 0c 9c 07  60 79 cb 0f  ....`y..              1257.1.0        
               cb 79 cd 01  15 97 15 76  .y.....v              1257.1.8        
               16 91 15 75  15 94 15 72  ...u...r              1257.1.16       
               16 94 18 72  19 8f 19 74  ...r...t              1257.1.24       
  57    ISOC                                                   1258.1.0(5)     
  57.2  ISOC   0c 0d 9c 2a  f2 78 86 c3  ...*.x..              1263.1.0        
               48 79 2d 01  14 96 15 73  Hy-....s              1263.1.8        
               14 99 14 74  15 9a 16 71  ...t...q              1263.1.16       
               17 96 17 71  17 97 17 70  ...q...p              1263.1.24       
  57.2  ISOC   0c 0d 9c e4  cd 79 75 20  .....yu               1264.1.0        
               26 7a 3d 02  15 94 14 75  &z=....u              1264.1.8        
               14 96 15 73  15 95 16 71  ...s...q              1264.1.16       
               15 95 15 72  15 94 16 70  ...r...p              1264.1.24       
  57.2  ISOC   0c 0d 9c e4  cd 79 48 36  .....yH6              1265.1.0        
               33 7a 4d 02  17 9b 18 70  3zM....p              1265.1.8        
               17 9b 19 6e  19 99 18 6f  ...n...o              1265.1.16       
               19 9c 19 70  19 9e 18 71  ...p...q              1265.1.24       
  57    ISOC                                                   1266.1.0        
  57.2  RESET                                                  1267.1.0        
  57.0  CTL    01 0b 00 00  01 00 00 00  SET INTERFACE         1268.1.0        
  57.0  CTL    a1 81 00 01  01 00 1a 00  GET CUR               1269.1.0        
  57.0  IN     00 00 01 02  15 16 05 00  ........              1269.2.0        
               00 00 00 00  00 00 00 00  ........              1269.2.8        
               00 00 00 60  09 00 00 0c  ...`....              1269.2.16       
               00 00                     ..                    1269.2.24       
  57.0  CTL    21 01 00 01  01 00 1a 00  SET CUR               1270.1.0        
  57.0  OUT    00 00 01 01  15 16 05 00  ........              1270.2.0        
               00 00 00 00  00 00 00 00  ........              1270.2.8        
               00 00 00 60  09 00 00 00  ...`....              1270.2.16       
               00 00                     ..                    1270.2.24       
  57.0  CTL    a1 81 00 01  01 00 1a 00  GET CUR               1271.1.0        
  57.0  IN     00 00 01 01  15 16 05 00  ........              1271.2.0        
               00 00 00 00  00 00 00 00  ........              1271.2.8        
               00 00 00 60  09 00 00 0c  ...`....              1271.2.16       
               00 00                     ..                    1271.2.24       
  57.0  CTL    a1 83 00 01  01 00 1a 00  GET MAX               1272.1.0        
  57.0  IN     00 00 01 01  15 16 05 00  ........              1272.2.0        
               00 00 00 00  00 00 00 00  ........              1272.2.8        
               00 00 00 60  09 00 00 0c  ...`....              1272.2.16       
               00 00                     ..                    1272.2.24       
  57.0  CTL    a1 82 00 01  01 00 1a 00  GET MIN               1273.1.0        
  57.0  IN     00 00 01 01  15 16 05 00  ........              1273.2.0        
               00 00 00 00  00 00 00 00  ........              1273.2.8        
               00 00 00 60  09 00 00 0c  ...`....              1273.2.16       
               00 00                     ..                    1273.2.24       
  57.0  CTL    21 01 00 01  01 00 1a 00  SET CUR               1274.1.0        
  57.0  OUT    00 00 01 01  15 16 05 00  ........              1274.2.0        
               00 00 00 00  00 00 00 00  ........              1274.2.8        
               00 00 00 60  09 00 00 00  ...`....              1274.2.16       
               00 00                     ..                    1274.2.24       
  57.0  CTL    a1 81 00 01  01 00 1a 00  GET CUR               1275.1.0        
  57.0  IN     00 00 01 01  15 16 05 00  ........              1275.2.0        
               00 00 00 00  00 00 00 00  ........              1275.2.8        
               00 00 00 60  09 00 00 0c  ...`....              1275.2.16       
               00 00                     ..                    1275.2.24       
  57.0  CTL    21 01 00 02  01 00 1a 00  SET CUR               1276.1.0        
  57.0  OUT    00 00 01 01  15 16 05 00  ........              1276.2.0        
               00 00 00 00  00 00 00 00  ........              1276.2.8        
               00 00 00 60  09 00 00 0c  ...`....              1276.2.16       
               00 00                     ..                    1276.2.24       
  57.0  CTL    01 0b 01 00  01 00 00 00  SET INTERFACE         1277.1.0        
  57    ISOC                                                   1278.1.0(4)     
  57.0  CTL    a1 81 00 02  00 02 02 00  GET CUR               1282.1.0        
  57.0  IN     80 00                     ..                    1282.2.0        
  57.0  CTL    21 01 00 02  00 02 02 00  SET CUR               1283.1.0        
  57.0  OUT    80 00                     ..                    1283.2.0        
  57.0  CTL    a1 81 00 02  00 02 02 00  GET CUR               1284.1.0        
  57.0  IN     80 00                     ..                    1284.2.0        
  57    ISOC                                                   1285.1.0(29)    
  57.2  ISOC   00 00 00 00  00 00 00 00  ........              1314.1.0        
               00 00 00 00  00 00 00 00  ........              1314.1.8        
               00 00 00 00  00 00 00 00  ........              1314.1.16       
               00 00 00 00  00 00 00 00  ........              1314.1.24       
  57.2  ISOC   0c 0c 9c c1  3b 7a b1 53  ....;z.S              1315.1.0        
               13 7c 9b 04  21 98 21 60  ....!.!`              1315.1.8        
               1f 99 1f 61  21 98 1f 62  ...a!..b              1315.1.16       
               1f 96 1f 64  1f 96 1e 64  ...d...d              1315.1.24       
  57.2  ISOC   0c 0c 9c c1  3b 7a 01 59  ....;z.Y              1316.1.0        
               20 7c ab 04  18 86 19 6f   ......o              1316.1.8        
               19 87 19 6e  19 85 1a 6d  ...n...m              1316.1.16       
               19 83 1a 6e  1a 83 1a 6d  ...n...m              1316.1.24       
  57    ISOC                                                   1317.1.0(5)     
  57.2  ISOC   00 00 00 00  00 00 00 00  ........              1322.1.0        
               00 00 00 00  00 00 00 00  ........              1322.1.8        
               00 00 00 00  00 00 00 00  ........              1322.1.16       
               00 00 00 00  00 00 00 00  ........              1322.1.24       
  57.2  ISOC   0c 0d 6a cf  21 7c 64 7e  ..j.!.d.              1323.1.0        
               7b 7c 1b 05  1b 88 1b 65  .......e              1323.1.8        
               1b 8a 1a 66  1b 8b 1b 65  ...f...e              1323.1.16       
               1b 8a 1b 65  1d 87 1c 66  ...e...f              1323.1.24       
  57.2  ISOC   0c 0d 6a cf  21 7c d4 83  ..j.!...              1324.1.0        
               88 7c 2b 05  1c 7e 19 6f  ..+....o              1324.1.8        
               19 82 16 6e  15 84 15 70  ...n...p              1324.1.16       
               15 82 14 71  14 7f 13 6f  ...q...o              1324.1.24       
  57    ISOC                                                   1325.1.0(5)     
  57.2  ISOC   00 00 00 00  00 00 00 00  ........              1330.1.0        
               00 00 00 00  00 00 00 00  ........              1330.1.8        
               00 00 00 00  00 00 00 00  ........              1330.1.16       
               00 00 00 00  00 00 00 00  ........              1330.1.24       
  57.2  ISOC   0c 0c 70 ac  8f 7c 91 ae  ..p.....              1331.1.0        
               e3 7c 9b 05  13 7b 14 6f  .......o              1331.1.8        
               14 79 14 6f  14 79 14 6f  .y.o.y.o              1331.1.16       
               14 79 14 6f  13 7b 13 71  .y.o...q              1331.1.24       
  57.2  ISOC   0c 0c 70 ac  8f 7c 59 b3  ..p...Y.              1332.1.0        
               f0 7c ab 05  17 86 17 6b  .......k              1332.1.8        
               17 85 17 6c  17 85 17 6a  ...l...j              1332.1.16       
               19 86 18 68  19 88 18 6a  ...h...j              1332.1.24       
  57    ISOC                                                   1333.1.0(6)     
  57.2  ISOC   0c 0d 6a cf  21 7c 64 7e  ..j.!.d.              1339.1.0        
               7b 7c 1b 05  1b 88 1b 65  .......e              1339.1.8        
               1b 8a 1a 66  1b 8b 1b 65  ...f...e              1339.1.16       
               1b 8a 1b 65  1d 87 1c 66  ...e...f              1339.1.24       
  57.2  ISOC   0c 0d 6e 89  fd 7c dc d9  ..n.....              1340.1.0        
               58 7d 2b 06  17 93 17 6e  X.+....n              1340.1.8        
               19 95 19 6d  1a 95 19 6d  ...m...m              1340.1.16       
               1a 95 19 6d  19 97 19 6e  ...m...n              1340.1.24       
  57.2  ISOC   0c 0d 6e 89  fd 7c ac de  ..n.....              1341.1.0        
               65 7d 3b 06  18 8c 18 71  e.;....q              1341.1.8        
               18 8c 18 72  18 8e 18 70  ...r...p              1341.1.16       
               18 8f 19 70  18 91 18 72  ...p...r              1341.1.24       
  57    ISOC                                                   1342.1.0(5)     
  57.2  ISOC   0c 0c 70 ac  8f 7c 91 ae  ..p.....              1347.1.0        
               e3 7c 9b 05  13 7b 14 6f  .......o              1347.1.8        
               14 79 14 6f  14 79 14 6f  .y.o.y.o              1347.1.16       
               14 79 14 6f  13 7b 13 71  .y.o...q              1347.1.24       
  57.2  ISOC   0c 0c 6e 66  6b 7d 31 03  ..nfk.1.              1348.1.0        
               c1 7d ab 06  1c 9c 1c 68  .......h              1348.1.8        
               1e 9a 1e 67  1e 99 1e 69  ...g...i              1348.1.16       
               1d 9a 1e 67  1d 9a 1e 67  ...g...g              1348.1.24       
  57.2  ISOC   0c 0c 6e 66  6b 7d a1 08  ..nfk...              1349.1.0        
               ce 7d bb 06  25 a4 25 60  ....%.%`              1349.1.8        
               25 a9 26 61  26 a8 27 62  %.&a&.'b              1349.1.16       
               26 a6 27 60  27 a3 26 60  &.'`'.&`              1349.1.24       
  57    ISOC                                                   1350.1.0(3)     
  57    ISOC                                                   1353.1.0        
